internship_title,internship_company,required_skills,internship_location,required_education,Stipend,mode,duration
Software Developer,APARNA INFRAHOUSING PRIVATE LIMITED (PART IX),"Cloud Computing, Machine Learning, Cybersecurity, Java",Jaipur,M.Sc,"3,263.00",in-person,11 months
Surveyor,RASHMI CEMENT LIMITED,"Surveying, Estimation, Quality Control, Structural Design",Jaipur,BCA,"9,213.00",in-person,6 months
Renewable Energy Specialist,KARNATAKA POWER TRANSMISSION CORPORATION LIMITED,"Energy Efficiency, Renewable Energy, Power Plant Operations",Lucknow,BCA,"8,334.00",in-person,2 months
Machine Learning Engineer,SCHNEIDER ELECTRIC INDIA PRIVATE LIMITED,"Data Analysis, Cybersecurity, SQL, DevOps",Hyderabad,MBA,"1,606.00",in-person,7 months
IT Support,FIDELITY BUSINESS SERVICES INDIA PRIVATE LIMITED,"Machine Learning, Cloud Computing, Data Analysis, Python",Mumbai,B.Tech,"3,021.00",hybrid,3 months
Cloud Architect,INFOSYS BPM LIMITED,"Data Analysis, DevOps",Jaipur,B.Sc,"5,174.00",in-person,6 months
RF Engineer,ATC TELECOM INFRASTRUCTURE PRIVATE LIMITED,"Data Transmission, RF Engineering",Hyderabad,PhD,"1,676.00",online,2 months
Civil Engineer,JCB INDIA LIMITED,"Project Management, Construction Management, Structural Design",Remote,B.Com,"5,190.00",in-person,9 months
IT Support,LTIMINDTREE LIMITED,"Data Analysis, Cybersecurity",Bangalore,BBA,"2,396.00",in-person,2 months
Web Developer,HCL TECHNOLOGIES LIMITED,"Data Analysis, Cloud Computing, Python",Pune,B.Com,"8,772.00",in-person,8 months
Cloud Architect,WHIRLPOOL OF INDIA LIMITED,"DevOps, Cloud Computing, React, Python",Delhi,PhD,"5,942.00",online,12 months
IT Support,TATA SONS PRIVATE LIMITED,"Java, Data Analysis, Cloud Computing",Ahmedabad,MBA,"5,742.00",online,9 months
Environmental Officer,JSW STEEL LIMITED,"Mineral Processing, Geology",Delhi,PhD,"5,615.00",in-person,12 months
Machine Learning Engineer,ADITYA BIRLA FINANCE LIMITED,"Cybersecurity, DevOps, JavaScript, Cloud Computing",Mumbai,B.Tech,"8,418.00",hybrid,2 months
Data Analyst,NOKIA SOLUTIONS AND NETWORKS INDIA PRIVATE LIMITED,"RF Engineering, Optical Fiber",Hyderabad,MBA,"5,174.00",online,8 months
IT Support,J. P. MORGAN SERVICES INDIA PRIVATE LIMITED,"Cloud Computing, Data Analysis",Pune,B.Com,"5,375.00",in-person,4 months
Environmental Officer,PRAKASH INDUSTRIES LIMITED,"Ore Processing, Safety Management",Bangalore,MBA,"5,060.00",in-person,10 months
Civil Engineer,WONDER CEMENT LIMITED,"Project Management, Quality Control, Safety Management",Mumbai,MBA,"6,345.00",online,8 months
Web Developer,INFOSYS LIMITED,"Java, Data Analysis, React",Delhi,BCA,"9,755.00",hybrid,12 months
DevOps Engineer,ORACLE INDIA PRIVATE LIMITED,"DevOps, Java, Data Analysis, SQL",Chennai,B.Sc,"9,065.00",in-person,10 months
Credit Analyst,CITY UNION BANK LIMITED,"Financial Analysis, Financial Modeling, Investment Banking, Wealth Management",Jaipur,M.Sc,"9,290.00",online,5 months
Risk Analyst,TAMILNAD MERCANTILE BANK LIMITED,"Financial Modeling, Taxation",Pune,MBA,"9,974.00",in-person,6 months
Data Analyst,SBI FUNDS MANAGEMENT LIMITED,"DevOps, Machine Learning",Bangalore,M.Sc,"8,989.00",online,7 months
Civil Engineer,AARTI INDUSTRIES LTD,"Civil Engineering, Surveying, Project Management, Construction Management",Delhi,BCA,"4,330.00",hybrid,7 months
Distribution Executive,UPL LIMITED,"Brand Management, Consumer Insights, Distribution, Marketing",Bangalore,B.Tech,"5,191.00",hybrid,8 months
DevOps Engineer,JAQUAR AND COMPANY PRIVATE LIMITED,"JavaScript, Cybersecurity",Pune,B.Sc,"8,404.00",in-person,4 months
Hardware Engineer,SAMSUNG INDIA ELECTRONICS PRIVATE LIMITED,"Testing, Circuit Design, R&D, Quality Control",Pune,MBA,"2,318.00",hybrid,7 months
Software Developer,CGI INFORMATION SYSTEMS AND MANAGEMENT CONSULTANTS PRIVATE LIMITED,"DevOps, JavaScript, Data Analysis, Cloud Computing",Bangalore,BBA,"2,539.00",online,12 months
Mineral Processing Engineer,AIA ENGINEERING LIMITED,"Mineral Processing, Exploration",Ahmedabad,M.Sc,"7,251.00",online,11 months
Cloud Architect,HAVELLS INDIA LIMITED,"JavaScript, React, Machine Learning",Pune,B.Com,"2,032.00",in-person,12 months
Supply Chain Analyst,PATANJALI FOODS LIMITED,"Supply Chain, Product Development, Marketing, Consumer Insights",Bangalore,BCA,"7,155.00",in-person,6 months
Financial Analyst,KOTAK MAHINDRA BANK LIMITED,"Investment Banking, Financial Modeling, Accounting, Auditing",Delhi,Diploma,"5,837.00",hybrid,10 months
Surveyor,THE SUPREME INDUSTRIES LIMITED,"Quality Control, Surveying, Construction Management, Safety Management",Hyderabad,B.Sc,"6,954.00",online,12 months
Brand Manager,ABBOTT INDIA LIMITED,"Consumer Insights, Retail Management, Sales",Ahmedabad,MBA,"8,800.00",hybrid,2 months
Web Developer,INTERNATIONAL TRACTORS LIMITED,"DevOps, React, SQL, Data Analysis",Chennai,BA,"9,344.00",in-person,12 months
Web Developer,TOYOTA KIRLOSKAR MOTOR PRIVATE LIMITED,"Data Analysis, DevOps",Kolkata,B.Sc,"1,701.00",in-person,12 months
Data Analyst,ACCENTURE SOLUTIONS PRIVATE LIMITED,"Cloud Computing, React",Ahmedabad,M.Sc,"9,307.00",hybrid,2 months
Machine Learning Engineer,STAR INDIA PRIVATE LIMITED,"Cybersecurity, React",Mumbai,BA,"4,547.00",hybrid,3 months
Web Developer,MRF LIMITED,"Java, Python, Cloud Computing",Lucknow,BCA,"9,248.00",in-person,7 months
IT Support,SKF INDIA LIMITED,"JavaScript, DevOps",Jaipur,BBA,"2,122.00",hybrid,8 months
Data Analyst,PIRAMAL CAPITAL & HOUSING FINANCE LIMITED,"React, Python, Cybersecurity",Delhi,Diploma,"3,486.00",in-person,7 months
IT Support,TECH MAHINDRA LIMITED,"SQL, Machine Learning, Python",Jaipur,B.Com,"1,519.00",online,8 months
Data Analyst,ZEROIDA BROKING LIMITED,"React, Machine Learning, DevOps",Mumbai,BBA,"1,958.00",hybrid,9 months
Data Analyst,FINOLEX CABLES LIMITED,"Python, Cloud Computing",Bangalore,B.Sc,"8,407.00",hybrid,7 months
Structural Engineer,PATAKA INDUSTRIES PRIVATE LIMITED,"Estimation, Project Management",Lucknow,BA,"3,615.00",online,4 months
Site Engineer,ATUL LIMITED,"Estimation, Surveying",Pune,B.Com,"9,976.00",in-person,9 months
Process Engineer,OIL AND NATURAL GAS CORPORATION LIMITED,"Field Operations, Safety Compliance, Reservoir Engineering, Petroleum Engineering",Jaipur,PhD,"2,131.00",in-person,11 months
IT Support,ICICI SECURITIES PRIMARY DEALERSHIP LIMITED,"JavaScript, SQL",Bangalore,B.Com,"3,607.00",hybrid,2 months
Data Analyst,MICROSOFT INDIA (R&D) PRIVATE LIMITED,"Cloud Computing, SQL",Remote,BA,"6,655.00",in-person,11 months
Environmental Officer,AIA ENGINEERING LIMITED,"Mineral Processing, Exploration",Lucknow,Diploma,"1,932.00",online,4 months
Cloud Architect,EDGEVERVE SYSTEMS LIMITED,"Cloud Computing, DevOps, Java",Jaipur,Diploma,"2,951.00",online,10 months
Site Engineer,WONDER CEMENT LIMITED,"Civil Engineering, Structural Design",Ahmedabad,B.Sc,"6,579.00",in-person,9 months
Civil Engineer,GHCL LIMITED,"Project Management, Civil Engineering, Structural Design, Surveying",Chennai,BCA,"3,436.00",hybrid,8 months
Maintenance Engineer,WINSOL SOLAR FIELDS (POLEPALLY) PRIVATE LIMITED,"Maintenance, Energy Efficiency, Power Plant Operations",Mumbai,BBA,"4,533.00",in-person,4 months
Civil Engineer,PKC INFRATECH LIMITED,"Estimation, Structural Design, Surveying, Quality Control",Hyderabad,B.Com,"5,210.00",in-person,3 months
Reservoir Engineer,BHARAT PETROLEUM CORPORATION LIMITED,"Refining, Reservoir Engineering, Geology, Safety Compliance",Pune,PhD,"9,158.00",in-person,2 months
IT Support,ENDURANCE TECHNOLOGIES LIMITED,"Java, SQL, Python, JavaScript",Kolkata,MBA,"8,803.00",hybrid,12 months
Drilling Engineer,MAHANAGAR GAS LIMITED,"Petroleum Engineering, Pipeline Maintenance, Safety Compliance",Kolkata,BCA,"8,540.00",online,5 months
Machine Learning Engineer,POWER FINANCE CORPORATION LIMITED,"Machine Learning, Data Analysis",Bangalore,M.Sc,"6,026.00",hybrid,9 months
IT Support,ENDURANCE TECHNOLOGIES LIMITED,"Java, SQL, Python, JavaScript",Kolkata,MBA,"8,966.00",in-person,12 months
Safety Officer,INDIAN METALS AND FERRO ALLOYS LTD.,"Surveying, Mining Engineering",Remote,BA,"8,884.00",hybrid,4 months
Petroleum Engineer,GAIL (INDIA) LIMITED,"Safety Compliance, Reservoir Engineering, Refining, Pipeline Maintenance",Remote,B.Com,"6,446.00",in-person,11 months
Surveyor,IREL (INDIA) LIMITED,"Safety Management, Geology",Bangalore,MBA,"6,674.00",in-person,9 months
Consumer Insights Analyst,NIRMA LIMITED,"Product Development, Marketing",Remote,PhD,"1,837.00",online,7 months
Cloud Architect,VENCO RESEARCH AND BREEDING FARM PRIVATE LIMITED,"DevOps, Python, React",Pune,BCA,"3,997.00",online,7 months
Data Analyst,MICROSOFT INDIA (R&D) PRIVATE LIMITED,"Cloud Computing, SQL",Remote,BA,"7,226.00",online,11 months
Surveyor,ARCELORMITTAL NIPPON STEEL INDIA LIMITED,"Mineral Processing, Geology, Surveying, Mining Engineering",Pune,BCA,"5,550.00",online,5 months
Safety Officer,KARNATAKA RURAL INFRASTRUCTURE DEVELOPMENT LIMITED,"Structural Design, Construction Management, Estimation",Delhi,B.Tech,"1,881.00",in-person,12 months
Geologist,JSW STEEL COATED PRODUCTS LIMITED,"Surveying, Mineral Processing, Ore Processing",Pune,BA,"2,670.00",online,9 months
Safety Officer,INDRAPRASTHA GAS LIMITED,"Reservoir Engineering, Pipeline Maintenance, Refining, Geology",Hyderabad,B.Com,"2,195.00",online,7 months
Product Manager,ABBOTT INDIA LIMITED,"Product Development, Distribution, Retail Management, Marketing",Chennai,PhD,"1,755.00",in-person,7 months
Cloud Architect,ADITYA BIRLA FINANCE LIMITED,"Cybersecurity, Java, React, Data Analysis",Delhi,M.Sc,"4,153.00",hybrid,6 months
Machine Learning Engineer,ORACLE FINANCIAL SERVICES SOFTWARE LIMITED,"Data Analysis, Machine Learning, React",Mumbai,BBA,"9,286.00",in-person,6 months
Design Engineer,ADANI POWER LIMITED,"Transmission, Maintenance",Mumbai,BCA,"9,510.00",online,4 months
QA Engineer,BAGMANE DEVELOPERS PRIVATE LIMITED,"Cybersecurity, Machine Learning, Cloud Computing, Java",Bangalore,PhD,"9,307.00",online,12 months
Project Engineer,THE ASSOCIATED BUILDING COMPANY LIMITED,"Project Management, Structural Design, Civil Engineering",Remote,Diploma,"8,965.00",online,7 months
Risk Analyst,AXIS BANK LIMITED,"Financial Analysis, Investment Banking, Taxation",Delhi,B.Com,"5,361.00",in-person,12 months
IT Support,ENDURANCE TECHNOLOGIES LIMITED,"Java, SQL, Python, JavaScript",Kolkata,MBA,"1,772.00",hybrid,7 months
Mining Engineer,JINDAL SAW LIMITED,"Mining Engineering, Environmental Compliance",Delhi,B.Sc,"5,474.00",online,7 months
Marketing Executive,PROCTER & GAMBLE HOME PRODUCTS PRIVATE LIMITED,"Marketing, Brand Management, Retail Management, Supply Chain",Lucknow,PhD,"5,809.00",online,9 months
Cloud Architect,HAVELLS INDIA LIMITED,"JavaScript, React, Machine Learning",Pune,B.Com,"9,440.00",online,10 months
Software Developer,ATRIA CONVERGENCE TECHNOLOGIES LIMITED,"Python, Cloud Computing",Chennai,B.Sc,"5,789.00",in-person,2 months
Financial Analyst,BAJAJ ALLIANZ GENERAL INSURANCE COMPANY LIMITED,"Financial Modeling, Wealth Management, Investment Banking",Pune,BBA,"8,742.00",online,7 months
Web Developer,INFOSYS LIMITED,"Java, Data Analysis, React",Delhi,BCA,"1,920.00",online,11 months
Distribution Executive,PROCTER & GAMBLE HOME PRODUCTS PRIVATE LIMITED,"Brand Management, Marketing, Product Development, Distribution",Bangalore,MBA,"3,122.00",hybrid,4 months
Site Engineer,SAINT-GOBAIN INDIA PRIVATE LIMITED,"Project Management, Estimation, Surveying",Mumbai,B.Tech,"8,924.00",in-person,12 months
Product Manager,ABBOTT INDIA LIMITED,"Product Development, Distribution, Retail Management, Marketing",Chennai,PhD,"5,891.00",online,12 months
IT Support,MUSIGMA BUSINESS SOLUTIONS PRIVATE LIMITED,"SQL, DevOps",Remote,M.Sc,"1,951.00",hybrid,5 months
Relationship Manager,RBL BANK LIMITED,"Risk Management, Auditing, Taxation, Financial Modeling",Hyderabad,MBA,"3,708.00",online,8 months
Mineral Processing Engineer,MAHANADI COALFIELDS LIMITED,"Geology, Safety Management, Mining Engineering, Ore Processing",Kolkata,B.Sc,"3,598.00",in-person,7 months
Machine Learning Engineer,ESCORTS KUBOTA LIMITED,"Machine Learning, Data Analysis, Python, SQL",Chennai,BBA,"8,715.00",online,4 months
Network Engineer,BHARTI TELEMEDIA LIMITED,"Wireless Communication, IoT, RF Engineering, Network Engineering",Chennai,B.Tech,"6,777.00",hybrid,6 months
Mining Engineer,ARCELORMITTAL NIPPON STEEL INDIA LIMITED,"Exploration, Mineral Processing",Jaipur,BCA,"2,973.00",in-person,2 months
Safety Officer,GUJARAT GAS LIMITED,"Field Operations, Refining, Reservoir Engineering",Mumbai,BBA,"8,405.00",online,9 months
Construction Manager,DEEPAK NITRITE LIMITED,"Construction Management, Estimation",Mumbai,Diploma,"2,351.00",in-person,5 months
Credit Analyst,TATA AIG GENERAL INSURANCE COMPANY LIMITED,"Taxation, Financial Analysis, Investment Banking, Loan Processing",Remote,Diploma,"5,925.00",online,6 months
Marketing Executive,EVEREST FOOD PRODUCTS PRIVATE LIMITED,"Product Development, Brand Management",Pune,B.Tech,"1,566.00",in-person,2 months
Distribution Executive,MONDELEZ INDIA FOODS PRIVATE LIMITED,"Consumer Insights, Sales, Marketing, Distribution",Delhi,M.Sc,"6,352.00",online,2 months
DevOps Engineer,SOCIETE GENERALE SECURITIES INDIA PRIVATE LIMITED,"Java, Python, React",Delhi,MBA,"6,249.00",in-person,11 months
Cloud Architect,SBI CARDS AND PAYMENT SERVICES LIMITED,"JavaScript, Java",Mumbai,M.Sc,"6,131.00",online,10 months
Supply Chain Analyst,UNITED SPIRITS LIMITED,"Consumer Insights, Brand Management",Jaipur,B.Tech,"3,033.00",in-person,5 months
Sales Executive,ADANI WILMAR LIMITED,"Distribution, Product Development",Bangalore,B.Sc,"4,230.00",hybrid,12 months
Grid Engineer,POWER GRID CORPORATION OF INDIA LIMITED,"Thermal Power, Renewable Energy, Electrical Engineering",Delhi,B.Tech,"9,746.00",online,5 months
Surveyor,ODISHA MINING CORPORATION LIMITED,"Mineral Processing, Mining Engineering, Geology",Kolkata,B.Com,"2,518.00",online,10 months
IT Support,HSBC ELECTRONIC DATA PROCESSING INDIA PRIVATE LIMITED,"Machine Learning, React, Python, DevOps",Chennai,BCA,"9,966.00",online,7 months
Sales Executive,AJANTA PHARMA LIMITED,"Consumer Insights, Sales",Lucknow,M.Sc,"9,101.00",online,7 months
Web Developer,TOYOTA KIRLOSKAR MOTOR PRIVATE LIMITED,"Data Analysis, React, JavaScript",Hyderabad,BCA,"3,285.00",online,7 months
Ore Processing Technician,ORISSA METALIKS PRIVATE LIMITED,"Ore Processing, Geology",Hyderabad,B.Com,"2,900.00",online,2 months
Machine Learning Engineer,KANSAI NEROLAC PAINTS LIMITED,"SQL, Cloud Computing",Pune,BCA,"5,274.00",hybrid,4 months
Data Analyst,INFO EDGE (INDIA) LIMITED,"SQL, Machine Learning, Java, DevOps",Lucknow,BBA,"6,920.00",in-person,12 months
QA Engineer,KOTAK SECURITIES LIMITED,"React, DevOps",Bangalore,Diploma,"3,249.00",hybrid,8 months
Data Analyst,BALRAMPUR CHINI MILLS LTD,"SQL, Cloud Computing",Remote,BBA,"3,215.00",in-person,9 months
System Integrator,STERLITE TECHNOLOGIES LIMITED,"5G Technology, Optical Fiber",Remote,Diploma,"3,585.00",online,2 months
Financial Analyst,MAX LIFE INSURANCE COMPANY LIMITED,"Taxation, Auditing, Investment Banking, Financial Modeling",Chennai,BBA,"2,774.00",in-person,4 months
Supply Chain Analyst,MICRO LABS LIMITED,"Supply Chain, Product Development, Retail Management",Hyderabad,Diploma,"2,423.00",hybrid,12 months
Surveyor,RASHMI CEMENT LIMITED,"Surveying, Estimation, Quality Control, Structural Design",Jaipur,BCA,"7,574.00",in-person,6 months
Product Manager,SUVEN PHARMACEUTICALS LIMITED,"Consumer Insights, Retail Management, Supply Chain",Remote,B.Sc,"2,768.00",online,6 months
Field Engineer,GUJARAT STATE PETRONET LIMITED,"Reservoir Engineering, Drilling Operations, Field Operations",Kolkata,Diploma,"3,753.00",online,3 months
Distribution Executive,DABUR INDIA LIMITED,"Retail Management, Product Development, Sales",Mumbai,B.Sc,"7,578.00",hybrid,6 months
QA Engineer,GENPACT INDIA PRIVATE LIMITED,"JavaScript, SQL, Machine Learning",Hyderabad,BBA,"7,946.00",in-person,2 months
DevOps Engineer,CITICORP SERVICES INDIA PRIVATE LIMITED,"Python, Cybersecurity, Java",Remote,BCA,"5,580.00",online,3 months
Project Engineer,THE ASSOCIATED BUILDING COMPANY LIMITED,"Quality Control, Estimation",Ahmedabad,BA,"3,937.00",in-person,10 months
Sales Executive,MANKIND PHARMA LIMITED,"Retail Management, Brand Management, Product Development",Pune,B.Com,"2,681.00",hybrid,2 months
Software Developer,CUMMINS INDIA LIMITED,"Cloud Computing, Data Analysis",Ahmedabad,PhD,"8,459.00",in-person,5 months
Product Manager,PROCTER & GAMBLE HOME PRODUCTS PRIVATE LIMITED,"Consumer Insights, Marketing, Product Development",Bangalore,BBA,"9,441.00",online,7 months
Product Manager,GLAND PHARMA LTD,"Marketing, Distribution, Supply Chain, Retail Management",Ahmedabad,B.Com,"5,518.00",online,11 months
Cloud Architect,VENCO RESEARCH AND BREEDING FARM PRIVATE LIMITED,"DevOps, Python, React",Pune,BCA,"7,736.00",online,11 months
Structural Engineer,KNR CONSTRUCTIONS LIMITED,"Safety Management, Surveying, Civil Engineering, Project Management",Remote,MBA,"9,334.00",in-person,12 months
Cloud Architect,KARNAVATI AVIATION PRIVATE LIMITED,"SQL, Java, DevOps",Ahmedabad,BA,"6,832.00",online,5 months
Web Developer,DELL INTERNATIONAL SERVICES INDIA PRIVATE LIMITED,"JavaScript, DevOps",Kolkata,B.Sc,"8,037.00",in-person,5 months
Consumer Insights Analyst,APOLLO HOSPITALS ENTERPRISE LIMITED,"Marketing, Product Development",Mumbai,BCA,"3,738.00",in-person,8 months
Quality Inspector,THE SUPREME INDUSTRIES LIMITED,"Civil Engineering, Construction Management, Safety Management, Structural Design",Pune,BBA,"9,935.00",online,8 months
Construction Manager,MSPL LIMITED,"Construction Management, Estimation, Civil Engineering",Lucknow,B.Tech,"4,818.00",in-person,12 months
Safety Officer,FINOLEX INDUSTRIES LIMITED,"Civil Engineering, Safety Management, Estimation, Construction Management",Delhi,M.Sc,"8,258.00",in-person,3 months
Construction Manager,MODERN ROAD MAKERS P LTD,"Construction Management, Quality Control, Surveying",Chennai,Diploma,"4,266.00",hybrid,6 months
IT Support,VENCO RESEARCH AND BREEDING FARM PRIVATE LIMITED,"JavaScript, Cybersecurity, Python, Machine Learning",Delhi,B.Sc,"5,450.00",online,7 months
Data Analyst,BAJAJ HOUSING FINANCE LIMITED,"DevOps, Python, Java, Data Analysis",Jaipur,B.Tech,"4,198.00",hybrid,3 months
DevOps Engineer,AMARA RAJA ENERGY & MOBILITY LIMITED,"Data Analysis, Cybersecurity, Cloud Computing",Kolkata,B.Sc,"2,153.00",hybrid,4 months
Marketing Executive,EVEREST FOOD PRODUCTS PRIVATE LIMITED,"Product Development, Brand Management",Pune,B.Tech,"1,689.00",online,5 months
Exploration Geologist,NATIONAL ALUMINIUM CO LTD,"Geology, Mining Engineering, Exploration, Surveying",Delhi,MBA,"2,699.00",online,5 months
Project Engineer,SHREE RAMKRISHNA EXPORTS PRIVATE LIMITED,"Construction Management, Quality Control, Surveying, Safety Management",Kolkata,Diploma,"6,277.00",hybrid,3 months
Web Developer,EDELWEISS ASSET RECONSTRUCTION COMPANY LIMITED,"SQL, DevOps, Java",Delhi,PhD,"6,026.00",hybrid,7 months
Software Developer,BAJAJ HOLDINGS & INVESTMENT LIMITED.,"DevOps, Python, Data Analysis, Cloud Computing",Lucknow,Diploma,"9,004.00",hybrid,10 months
Sales Executive,AVENUE SUPERMARTS LIMITED,"Distribution, Sales",Jaipur,Diploma,"4,060.00",hybrid,11 months
IT Support,MUSIGMA BUSINESS SOLUTIONS PRIVATE LIMITED,"SQL, DevOps",Remote,M.Sc,"4,764.00",hybrid,4 months
Data Analyst,INGRAM MICRO INDIA PRIVATE LIMITED,"React, Machine Learning, DevOps, Java",Mumbai,BBA,"3,248.00",in-person,7 months
Web Developer,PERSISTENT SYSTEMS LIMITED,"Cloud Computing, React, Java, Cybersecurity",Remote,BCA,"1,793.00",in-person,11 months
Brand Manager,GLENMARK PHARMACEUTICALS LIMITED,"Brand Management, Marketing, Product Development, Distribution",Kolkata,BA,"2,023.00",online,8 months
Construction Manager,AARTI INDUSTRIES LTD,"Safety Management, Estimation, Project Management, Civil Engineering",Ahmedabad,M.Sc,"5,297.00",in-person,2 months
QA Engineer,ZEE ENTERTAINMENT ENTERPRISES LIMITED,"Java, Cloud Computing, React",Remote,Diploma,"3,632.00",online,2 months
Surveyor,ARCELORMITTAL NIPPON STEEL INDIA LIMITED,"Mineral Processing, Geology, Surveying, Mining Engineering",Pune,BCA,"6,818.00",in-person,10 months
Exploration Geologist,AIA ENGINEERING LIMITED,"Surveying, Exploration",Hyderabad,BCA,"9,874.00",online,12 months
DevOps Engineer,DELOITTE CONSULTING INDIA PRIVATE LIMITED,"Java, Python, JavaScript, Machine Learning",Mumbai,B.Com,"4,590.00",in-person,4 months
Sales Executive,AJANTA PHARMA LIMITED,"Consumer Insights, Sales",Lucknow,M.Sc,"2,918.00",online,3 months
IT Support,NOVATEUR ELECTRICAL & DIGITAL SYSTEMS PRIVATE LIMITED,"Cloud Computing, Machine Learning",Kolkata,B.Tech,"5,723.00",hybrid,12 months
Civil Engineer,BRAHMAPUTRA CRACKER AND POLYMER LIMITED,"Estimation, Surveying",Delhi,MBA,"9,496.00",online,3 months
Consumer Insights Analyst,USV PRIVATE LIMITED,"Supply Chain, Distribution, Product Development",Remote,B.Tech,"5,709.00",in-person,9 months
Supply Chain Analyst,ADANI PORTS AND SPECIAL ECONOMIC ZONE LIMITED,"Freight Management, Procurement, Transportation, Warehouse Operations",Pune,B.Sc,"3,894.00",in-person,11 months
Software Developer,TOPCON SOKKIA INDIA PRIVATE LIMITED,"Machine Learning, Data Analysis, SQL",Pune,PhD,"2,371.00",hybrid,6 months
Machine Learning Engineer,GODREJ SEEDS & GENETICS LIMITED,"React, DevOps, Machine Learning",Ahmedabad,B.Tech,"3,298.00",online,3 months
Supply Chain Analyst,PARLE BISCUITS PRIVATE LIMITED,"Supply Chain, Marketing, Distribution, Brand Management",Pune,B.Tech,"9,966.00",hybrid,11 months
Network Engineer,INDUS TOWERS LIMITED,"Optical Fiber, Wireless Communication",Lucknow,MBA,"5,640.00",hybrid,11 months
Distribution Executive,MONDELEZ INDIA FOODS PRIVATE LIMITED,"Brand Management, Consumer Insights, Supply Chain, Product Development",Ahmedabad,Diploma,"7,314.00",in-person,3 months
Environmental Officer,AIA ENGINEERING LIMITED,"Mineral Processing, Exploration",Lucknow,Diploma,"8,776.00",in-person,9 months
Environmental Officer,TATA STEEL LIMITED,"Geology, Ore Processing",Pune,BBA,"2,445.00",in-person,9 months
IT Support,STANDARD CHARTERED GLOBAL BUSINESS SERVICES PRIVATE LIMITED,"Cloud Computing, Python, Cybersecurity",Lucknow,B.Com,"3,389.00",online,5 months
Data Analyst,WNS GLOBAL SERVICES PRIVATE LIMITED,"Python, React, Java",Hyderabad,B.Com,"7,364.00",hybrid,3 months
Surveyor,BIOP STEELS & POWER PRIVATE LIMITED,"Geology, Surveying",Jaipur,BA,"4,184.00",hybrid,5 months
Risk Analyst,TAMILNAD MERCANTILE BANK LIMITED,"Financial Modeling, Taxation",Pune,MBA,"7,655.00",online,3 months
Surveyor,ARCELORMITTAL NIPPON STEEL INDIA LIMITED,"Mineral Processing, Geology, Surveying, Mining Engineering",Pune,BCA,"7,526.00",online,8 months
DevOps Engineer,REDINGTON LIMITED,"Machine Learning, Cybersecurity",Jaipur,PhD,"5,317.00",online,3 months
Project Engineer,GAWAR CONSTRUCTION LIMITED.,"Project Management, Construction Management, Safety Management, Structural Design",Chennai,B.Sc,"3,845.00",online,7 months
QA Engineer,GOOGLE IT SERVICES INDIA PRIVATE LIMITED,"Machine Learning, Java, DevOps",Kolkata,B.Com,"2,790.00",hybrid,11 months
Power Plant Operator,TANJORE POWER LIMITED,"Energy Efficiency, Thermal Power",Chennai,MBA,"5,200.00",online,8 months
QA Engineer,POLYCAB INDIA LIMITED,"SQL, Cybersecurity, DevOps",Remote,Diploma,"2,283.00",in-person,3 months
Environmental Officer,NORTHERN COALFIELDS LIMITED,"Exploration, Geology, Surveying, Safety Management",Chennai,MBA,"8,078.00",online,11 months
Safety Officer,OIL INDIA LIMITED,"Pipeline Maintenance, Reservoir Engineering, Field Operations",Chennai,MBA,"3,147.00",hybrid,11 months
Transportation Specialist,ADANI HARBOUR SERVICES LIMITED,"Supply Chain Management, Warehouse Operations, Transportation",Mumbai,M.Sc,"9,071.00",hybrid,12 months
QA Engineer,CAPGEMINI TECHNOLOGY SERVICES INDIA LIMITED,"DevOps, Cloud Computing, Machine Learning, SQL",Jaipur,PhD,"7,649.00",online,3 months
DevOps Engineer,WIPRO ENTERPRISES PRIVATE LIMITED,"Python, Machine Learning, SQL",Mumbai,BCA,"6,253.00",in-person,9 months
IT Support,INFOSYS LIMITED,"SQL, DevOps, Cloud Computing, Cybersecurity",Ahmedabad,B.Com,"5,130.00",online,6 months
Consumer Insights Analyst,ALKEM LABORATORIES LIMITED,"Consumer Insights, Distribution, Brand Management, Retail Management",Pune,Diploma,"6,169.00",in-person,5 months
Safety Officer,WESTERN COALFIELDS LIMITED,"Surveying, Ore Processing",Chennai,M.Sc,"8,659.00",in-person,6 months
Ore Processing Technician,MAHANADI COALFIELDS LIMITED,"Exploration, Mineral Processing, Geology",Chennai,Diploma,"7,472.00",in-person,10 months
Web Developer,HDFC SECURITIES LIMITED,"Python, JavaScript, React, DevOps",Chennai,PhD,"7,911.00",in-person,4 months
Data Analyst,ICICI PRUDENTIAL ASSET MANAGEMENT COMPANY LIMITED,"Cloud Computing, Java, DevOps, Data Analysis",Delhi,Diploma,"2,398.00",hybrid,7 months
Software Developer,PRESTIGE ESTATES PROJECTS LIMITED,"Cybersecurity, Java, SQL",Pune,B.Com,"1,635.00",in-person,11 months
Surveyor,MSPL LIMITED,"Estimation, Structural Design",Jaipur,MBA,"5,371.00",online,12 months
Network Engineer,INDUS TOWERS LIMITED,"Optical Fiber, Wireless Communication",Lucknow,MBA,"3,199.00",hybrid,9 months
Construction Manager,G R INFRAPROJECTS LIMITED,"Estimation, Structural Design, Construction Management, Quality Control",Mumbai,B.Tech,"9,645.00",hybrid,4 months
Civil Engineer,GHCL LIMITED,"Structural Design, Estimation",Ahmedabad,M.Sc,"8,308.00",hybrid,7 months
IT Support,TATA CAPITAL HOUSING FINANCE LIMITED,"Cloud Computing, JavaScript",Hyderabad,BA,"4,553.00",hybrid,6 months
IT Support,ECGC LIMITED,"Cloud Computing, Java, JavaScript",Pune,BCA,"9,641.00",hybrid,4 months
IT Support,NOVATEUR ELECTRICAL & DIGITAL SYSTEMS PRIVATE LIMITED,"Cloud Computing, Machine Learning",Kolkata,B.Tech,"9,521.00",online,7 months
Exploration Geologist,JINDAL ALUMINIUM LIMITED,"Ore Processing, Exploration, Geology",Hyderabad,B.Com,"9,273.00",online,8 months
