internship_title,internship_company,required_skills,internship_location,required_education,Stipend,mode,duration
Site Engineer,KEC INTERNATIONAL LIMITED,"Safety Management, Surveying, Structural Design, Project Management",Kolkata,MBA,"5,725.00",in-person,11 months
Software Developer,MACROTECH DEVELOPERS LIMITED,"Java, Python",Jaipur,BCA,"7,096.00",hybrid,10 months
Software Developer,HONDA MOTORCYCLE AND SCOOTER INDIA PVT LTD,"React, SQL, Cybersecurity, Data Analysis",Chennai,B.Sc,"4,292.00",online,7 months
Retail Manager,GLENMARK LIFE SCIENCES LIMITED,"Sales, Distribution",Hyderabad,B.Sc,"2,964.00",online,8 months
Distribution Executive,MONDELEZ INDIA FOODS PRIVATE LIMITED,"Brand Management, Consumer Insights, Supply Chain, Product Development",Ahmedabad,Diploma,"8,948.00",hybrid,11 months
QA Engineer,RELIANCE INDUSTRIES LIMITED,"Cloud Computing, Data Analysis, JavaScript",Chennai,BBA,"7,842.00",hybrid,4 months
Safety Officer,BHUSHAN POWER & STEEL LIMITED,"Ore Processing, Exploration, Surveying, Environmental Compliance",Remote,B.Com,"9,772.00",in-person,3 months
Financial Analyst,SBI LIFE INSURANCE COMPANY LIMITED,"Risk Management, Auditing",Remote,PhD,"2,249.00",in-person,7 months
Sales Executive,DR.REDDY S LABORATORIES LTD,"Product Development, Consumer Insights, Distribution, Supply Chain",Lucknow,B.Sc,"3,355.00",online,3 months
Retail Manager,EMAMI LIMITED,"Brand Management, Marketing",Bangalore,MBA,"4,964.00",in-person,5 months
Sales Executive,PERNOD RICARD INDIA PRIVATE LIMITED,"Consumer Insights, Marketing",Kolkata,B.Com,"6,827.00",in-person,11 months
Design Engineer,TATA POWER DELHI DISTRIBUTION LIMITED,"Transmission, Power Plant Operations, Thermal Power, Electrical Engineering",Jaipur,M.Sc,"4,620.00",in-person,5 months
DevOps Engineer,DLF LIMITED,"Python, SQL, Cybersecurity",Kolkata,BA,"4,972.00",in-person,11 months
Mining Engineer,JINDAL SAW LIMITED,"Mining Engineering, Environmental Compliance",Delhi,B.Sc,"6,216.00",online,3 months
Safety Officer,GUJARAT ALKALIES AND CHEMICALS LIMITED,"Civil Engineering, Quality Control",Chennai,M.Sc,"7,620.00",hybrid,11 months
Pipeline Engineer,PETRONET LNG LIMITED,"Drilling Operations, Geology",Kolkata,PhD,"7,410.00",online,2 months
QA Engineer,KOTAK SECURITIES LIMITED,"Java, SQL, Cybersecurity, Python",Mumbai,B.Tech,"5,593.00",hybrid,12 months
Geologist,BHUSHAN POWER & STEEL LIMITED,"Mining Engineering, Geology, Environmental Compliance",Bangalore,BA,"2,062.00",hybrid,6 months
Ore Processing Technician,EASTERN COALFIELDS LTD,"Environmental Compliance, Geology",Bangalore,MBA,"6,653.00",hybrid,10 months
Project Engineer,3M INDIA LIMITED,"Construction Management, Structural Design",Chennai,B.Sc,"8,658.00",online,8 months
Safety Officer,BHUSHAN POWER & STEEL LIMITED,"Ore Processing, Exploration, Surveying, Environmental Compliance",Remote,B.Com,"3,462.00",online,9 months
Brand Manager,LUPIN LIMITED,"Marketing, Distribution, Sales",Kolkata,B.Tech,"4,324.00",hybrid,7 months
Software Developer,INFOSYS LIMITED,"Python, Data Analysis, JavaScript, Cybersecurity",Delhi,Diploma,"8,268.00",in-person,7 months
Web Developer,BHARAT FORGE LTD,"Cybersecurity, Python, React",Mumbai,BCA,"4,318.00",in-person,7 months
Telecom Technician,INDUS TOWERS LIMITED,"IoT, Network Engineering, RF Engineering",Ahmedabad,PhD,"2,076.00",online,5 months
Supply Chain Analyst,RSPL LIMITED,"Supply Chain, Consumer Insights",Kolkata,B.Tech,"1,955.00",hybrid,9 months
IT Support,CHOLAMANDALAM INVESTMENT AND FINANCE COMPANY LIMITED,"Machine Learning, Cybersecurity, Cloud Computing, JavaScript",Hyderabad,MBA,"5,258.00",hybrid,10 months
Exploration Geologist,NATIONAL ALUMINIUM CO LTD,"Geology, Mining Engineering, Exploration, Surveying",Delhi,MBA,"4,599.00",in-person,5 months
Process Engineer,OIL AND NATURAL GAS CORPORATION LIMITED,"Field Operations, Safety Compliance, Reservoir Engineering, Petroleum Engineering",Jaipur,PhD,"2,618.00",in-person,5 months
DevOps Engineer,STANDARD CHARTERED GLOBAL BUSINESS SERVICES PRIVATE LIMITED,"Java, React, Machine Learning, Cloud Computing",Lucknow,BA,"3,939.00",hybrid,4 months
IT Support,CAN FIN HOMES LIMITED,"JavaScript, SQL, Java",Remote,PhD,"2,114.00",in-person,10 months
Site Engineer,SHREE CEMENT LIMITED,"Quality Control, Safety Management",Mumbai,MBA,"9,921.00",in-person,8 months
Distribution Executive,MONDELEZ INDIA FOODS PRIVATE LIMITED,"Brand Management, Consumer Insights, Supply Chain, Product Development",Ahmedabad,Diploma,"7,010.00",online,5 months
Petroleum Engineer,INDIAN OIL CORPORATION LIMITED,"Geology, Drilling Operations",Delhi,BCA,"7,811.00",in-person,7 months
Sales Executive,DR.REDDY S LABORATORIES LTD,"Product Development, Consumer Insights, Distribution, Supply Chain",Lucknow,B.Sc,"6,391.00",hybrid,11 months
Data Analyst,FRANKLIN TEMPLETON ASSET MANAGEMENT (INDIA) PRIVATE LIMITED,"JavaScript, React",Hyderabad,BA,"6,003.00",online,12 months
Brand Manager,AVENUE SUPERMARTS LIMITED,"Brand Management, Consumer Insights, Product Development, Marketing",Delhi,BA,"6,091.00",in-person,10 months
Supply Chain Analyst,TORRENT PHARMACEUTICALS LTD,"Marketing, Product Development, Distribution, Supply Chain",Delhi,BCA,"4,308.00",in-person,8 months
Data Analyst,INFO EDGE (INDIA) LIMITED,"SQL, Machine Learning, Java, DevOps",Lucknow,BBA,"5,195.00",hybrid,10 months
Machine Learning Engineer,MICROSOFT INDIA (R&D) PRIVATE LIMITED,"JavaScript, Data Analysis, SQL",Delhi,BCA,"3,576.00",in-person,8 months
Retail Manager,GLENMARK LIFE SCIENCES LIMITED,"Sales, Distribution",Hyderabad,B.Sc,"3,923.00",in-person,6 months
Consumer Insights Analyst,DABUR INDIA LIMITED,"Product Development, Marketing, Brand Management",Delhi,MBA,"9,646.00",in-person,6 months
System Integrator,STERLITE TECHNOLOGIES LIMITED,"5G Technology, Optical Fiber",Remote,Diploma,"3,307.00",in-person,11 months
Data Analyst,MICROSOFT INDIA (R&D) PRIVATE LIMITED,"SQL, DevOps",Pune,MBA,"3,717.00",hybrid,8 months
Credit Analyst,CITY UNION BANK LIMITED,"Financial Modeling, Accounting, Taxation, Financial Analysis",Ahmedabad,BA,"1,721.00",hybrid,12 months
DevOps Engineer,M.P. AGROTONICS LIMITED,"Cloud Computing, Machine Learning, Python",Mumbai,M.Sc,"6,408.00",in-person,7 months
Web Developer,DELL INTERNATIONAL SERVICES INDIA PRIVATE LIMITED,"Machine Learning, JavaScript, SQL",Pune,BBA,"3,923.00",hybrid,2 months
Marketing Executive,PI INDUSTRIES LIMITED,"Consumer Insights, Marketing",Jaipur,M.Sc,"7,810.00",in-person,5 months
Project Engineer,JAMNAGAR UTILITIES & POWER PRIVATE LIMITED,"Maintenance, Power Plant Operations, Transmission",Bangalore,B.Sc,"9,412.00",in-person,5 months
Machine Learning Engineer,SOCIETE GENERALE SECURITIES INDIA PRIVATE LIMITED,"Cybersecurity, Python",Kolkata,M.Sc,"5,580.00",hybrid,5 months
Project Engineer,3M INDIA LIMITED,"Construction Management, Structural Design",Chennai,B.Sc,"8,521.00",hybrid,2 months
Software Developer,BOSCH GLOBAL SOFTWARE TECHNOLOGIES PRIVATE LIMITED,"Cloud Computing, Machine Learning, React",Kolkata,B.Sc,"4,131.00",online,4 months
Credit Analyst,TATA AIG GENERAL INSURANCE COMPANY LIMITED,"Taxation, Financial Analysis, Investment Banking, Loan Processing",Remote,Diploma,"8,301.00",online,12 months
Machine Learning Engineer,TOYOTA KIRLOSKAR MOTOR PRIVATE LIMITED,"Python, Machine Learning",Lucknow,B.Tech,"8,690.00",in-person,6 months
DevOps Engineer,BERGER PAINTS INDIA LIMITED,"React, Machine Learning",Jaipur,Diploma,"1,849.00",in-person,5 months
Distribution Executive,AUROBINDO PHARMA LTD,"Brand Management, Consumer Insights, Product Development, Distribution",Hyderabad,BA,"7,560.00",online,11 months
Supply Chain Analyst,RITES LIMITED,"Inventory Management, Logistics Planning, Distribution",Pune,BCA,"9,394.00",in-person,12 months
Grid Engineer,SJVN LIMITED,"Electrical Engineering, Power Plant Operations",Ahmedabad,PhD,"6,086.00",hybrid,6 months
Software Developer,MACROTECH DEVELOPERS LIMITED,"Java, Python",Jaipur,BCA,"7,052.00",hybrid,9 months
Web Developer,GENPACT INDIA PRIVATE LIMITED,"Python, SQL, Java, React",Chennai,MBA,"7,919.00",online,6 months
Web Developer,PNB HOUSING FINANCE LIMITED,"Machine Learning, Java, React",Mumbai,BA,"3,312.00",in-person,11 months
Exploration Geologist,RUNGTA MINES LIMITED,"Surveying, Mining Engineering, Mineral Processing, Geology",Kolkata,B.Tech,"2,832.00",online,7 months
Consumer Insights Analyst,IPCA LABORATORIES LIMITED,"Distribution, Supply Chain, Brand Management",Mumbai,MBA,"6,903.00",hybrid,3 months
Exploration Geologist,HINDALCO INDUSTRIES LIMITED,"Safety Management, Exploration, Environmental Compliance, Surveying",Hyderabad,MBA,"5,429.00",online,12 months
Distribution Executive,UNITED BREWERIES LIMITED,"Consumer Insights, Brand Management, Retail Management, Marketing",Remote,M.Sc,"5,857.00",hybrid,8 months
QA Engineer,APARNA INFRAHOUSING PRIVATE LIMITED (PART IX),"Cybersecurity, Cloud Computing",Chennai,B.Sc,"4,236.00",hybrid,4 months
DevOps Engineer,SKODA AUTO VOLKSWAGEN INDIA PRIVATE LIMITED,"DevOps, Java",Remote,B.Tech,"3,179.00",in-person,2 months
Surveyor,ASHOKA BUILDCON LIMITED,"Safety Management, Surveying",Mumbai,B.Com,"5,797.00",in-person,5 months
Treasury Analyst,INDUSIND BANK LTD.,"Investment Banking, Accounting, Risk Management, Taxation",Kolkata,BCA,"3,684.00",online,8 months
Loan Officer,KOTAK MAHINDRA LIFE INSURANCE COMPANY LIMITED,"Accounting, Investment Banking",Bangalore,BBA,"3,490.00",in-person,5 months
Ore Processing Technician,INDIAN METALS AND FERRO ALLOYS LTD.,"Safety Management, Mineral Processing, Exploration, Environmental Compliance",Hyderabad,BBA,"1,649.00",online,11 months
Marketing Executive,RELIANCE RETAIL LIMITED,"Consumer Insights, Retail Management, Sales, Brand Management",Remote,M.Sc,"8,932.00",online,7 months
Exploration Geologist,HINDALCO INDUSTRIES LIMITED,"Safety Management, Exploration, Environmental Compliance, Surveying",Hyderabad,MBA,"4,110.00",in-person,10 months
Mining Engineer,TUBE INVESTMENTS OF INDIA LIMITED,"Mineral Processing, Geology, Surveying",Jaipur,B.Sc,"5,455.00",hybrid,8 months
Web Developer,BAJAJ FINANCE LIMITED,"DevOps, Machine Learning",Remote,M.Sc,"7,692.00",in-person,10 months
Site Engineer,NHDC LIMITED,"Quality Control, Estimation, Structural Design",Kolkata,MBA,"8,271.00",hybrid,4 months
Freight Coordinator,ADANI HAZIRA PORT LIMITED,"Warehouse Operations, Supply Chain Management",Jaipur,B.Sc,"2,042.00",online,5 months
Quality Inspector,COLOURTEX INDUSTRIES PRIVATE LIMITED,"Structural Design, Quality Control, Surveying, Project Management",Hyderabad,PhD,"1,546.00",hybrid,2 months
Project Engineer,SHREE RAMKRISHNA EXPORTS PRIVATE LIMITED,"Construction Management, Quality Control, Surveying, Safety Management",Kolkata,Diploma,"7,036.00",hybrid,11 months
DevOps Engineer,STANDARD CHARTERED GLOBAL BUSINESS SERVICES PRIVATE LIMITED,"Java, React, Machine Learning, Cloud Computing",Lucknow,BA,"9,251.00",online,4 months
QA Engineer,MAHINDRA AND MAHINDRA FINANCIAL SERVICES LIMITED,"DevOps, Machine Learning",Hyderabad,M.Sc,"8,533.00",in-person,4 months
Retail Manager,LAURUS LABS LIMITED,"Product Development, Retail Management",Kolkata,MBA,"6,269.00",in-person,11 months
Sales Executive,PERNOD RICARD INDIA PRIVATE LIMITED,"Consumer Insights, Marketing",Kolkata,B.Com,"8,133.00",hybrid,7 months
Supply Chain Analyst,PI INDUSTRIES LIMITED,"Supply Chain, Retail Management, Marketing, Distribution",Lucknow,BA,"7,384.00",hybrid,8 months
Petroleum Engineer,ADANI TOTAL GAS LIMITED,"Geology, Field Operations, Pipeline Maintenance",Lucknow,MBA,"4,957.00",in-person,2 months
Web Developer,SAMMAAN CAPITAL LIMITED,"Java, DevOps",Jaipur,BA,"2,357.00",online,7 months
Supply Chain Analyst,RELIANCE RETAIL VENTURES LIMITED,"Supply Chain, Consumer Insights, Sales, Retail Management",Jaipur,M.Sc,"1,641.00",hybrid,5 months
Credit Analyst,CITY UNION BANK LIMITED,"Financial Modeling, Accounting, Taxation, Financial Analysis",Ahmedabad,BA,"2,478.00",in-person,12 months
QA Engineer,PRESTIGE ESTATES PROJECTS LIMITED,"Java, Python, React, JavaScript",Kolkata,BBA,"9,823.00",in-person,11 months
Machine Learning Engineer,CROMPTON GREAVES CONSUMER ELECTRICALS LIMITED,"React, SQL, Cloud Computing, Python",Remote,B.Sc,"7,055.00",hybrid,5 months
Process Engineer,OIL AND NATURAL GAS CORPORATION LIMITED,"Field Operations, Safety Compliance, Reservoir Engineering, Petroleum Engineering",Jaipur,PhD,"7,054.00",hybrid,3 months
Distribution Executive,UPL LIMITED,"Brand Management, Consumer Insights, Distribution, Marketing",Bangalore,B.Tech,"6,468.00",hybrid,11 months
Drilling Engineer,MANGALORE REFINERY AND PETROCHEMICALS LIMITED,"Safety Compliance, Petroleum Engineering, Drilling Operations, Geology",Jaipur,BCA,"3,194.00",online,12 months
Ore Processing Technician,NMDC LIMITED,"Safety Management, Mineral Processing",Kolkata,Diploma,"4,509.00",hybrid,4 months
Consumer Insights Analyst,NIRMA LIMITED,"Brand Management, Product Development, Marketing",Hyderabad,BBA,"2,430.00",in-person,3 months
Marketing Executive,PI INDUSTRIES LIMITED,"Consumer Insights, Marketing",Jaipur,M.Sc,"2,374.00",hybrid,5 months
DevOps Engineer,LIC HOUSING FINANCE LTD,"Cybersecurity, React, Cloud Computing",Jaipur,M.Sc,"6,250.00",in-person,3 months
Brand Manager,GILLETTE INDIA LIMITED,"Distribution, Product Development, Supply Chain",Remote,PhD,"7,794.00",hybrid,2 months
QA Engineer,KOTAK SECURITIES LIMITED,"Java, SQL, Cybersecurity, Python",Mumbai,B.Tech,"9,268.00",in-person,8 months
Supply Chain Analyst,RITES LIMITED,"Inventory Management, Logistics Planning, Distribution",Pune,BCA,"7,396.00",online,4 months
Geologist,BIOP STEELS & POWER PRIVATE LIMITED,"Surveying, Ore Processing, Environmental Compliance",Remote,M.Sc,"9,963.00",online,3 months
Web Developer,LTIMINDTREE LIMITED,"JavaScript, SQL, Cloud Computing, Java",Chennai,BA,"4,061.00",in-person,12 months
Freight Coordinator,ADANI HAZIRA PORT LIMITED,"Warehouse Operations, Supply Chain Management",Jaipur,B.Sc,"9,496.00",hybrid,8 months
IT Support,TATA CAPITAL HOUSING FINANCE LIMITED,"Cloud Computing, JavaScript",Hyderabad,BA,"2,112.00",in-person,12 months
Consumer Insights Analyst,IPCA LABORATORIES LIMITED,"Distribution, Supply Chain, Brand Management",Mumbai,MBA,"7,903.00",in-person,7 months
Quality Inspector,TAMILNADU POWER FINANCE AND INFRASTRUCTURE DEVELOPMENT CORPORATION LIMITED,"Safety Management, Civil Engineering",Mumbai,BBA,"3,814.00",in-person,12 months
Environmental Officer,INDIAN METALS AND FERRO ALLOYS LTD.,"Geology, Safety Management",Kolkata,MBA,"9,090.00",online,12 months
Supply Chain Analyst,HINDUSTAN COCA-COLA BEVERAGES PRIVATE LIMITED,"Sales, Brand Management, Distribution, Product Development",Bangalore,B.Sc,"6,327.00",in-person,6 months
Quality Inspector,AARTI INDUSTRIES LTD,"Structural Design, Project Management, Estimation",Mumbai,BCA,"5,669.00",in-person,9 months
Thermal Engineer,KARNATAKA POWER TRANSMISSION CORPORATION LIMITED,"Energy Efficiency, Transmission, Thermal Power, Grid Management",Bangalore,MBA,"7,304.00",in-person,5 months
Risk Analyst,THE NEW INDIA ASSURANCE COMPANY LIMITED,"Investment Banking, Loan Processing",Pune,BCA,"1,816.00",online,6 months
Supply Chain Analyst,RSPL LIMITED,"Supply Chain, Consumer Insights",Kolkata,B.Tech,"4,026.00",online,7 months
Electronics Engineer,HP INDIA SALES PRIVATE LIMITED,"Electronics Design, Testing",Delhi,PhD,"6,943.00",hybrid,11 months
Retail Manager,GODREJ CONSUMER PRODUCTS LIMITED,"Supply Chain, Marketing, Product Development, Consumer Insights",Jaipur,Diploma,"7,051.00",online,12 months
Cloud Architect,INFOSYS BPM LIMITED,"Data Analysis, DevOps",Jaipur,B.Sc,"3,098.00",hybrid,8 months
Surveyor,GUJARAT NARMADA VALLEY FERTILIZERS & CHEMICALS LIMITED,"Safety Management, Surveying, Construction Management",Pune,BA,"6,464.00",in-person,12 months
Cloud Architect,CAPGEMINI TECHNOLOGY SERVICES INDIA LIMITED,"React, Java, Python, Cloud Computing",Mumbai,B.Com,"1,665.00",online,9 months
Product Manager,ADANI WILMAR LIMITED,"Supply Chain, Marketing, Distribution, Brand Management",Kolkata,B.Tech,"9,500.00",online,6 months
Construction Manager,DEEPAK NITRITE LIMITED,"Construction Management, Estimation",Mumbai,Diploma,"9,506.00",in-person,5 months
IT Support,CROMPTON GREAVES CONSUMER ELECTRICALS LIMITED,"Machine Learning, Python, Cloud Computing",Lucknow,BBA,"6,870.00",online,8 months
DevOps Engineer,RELIANCE INDUSTRIES LIMITED,"Cloud Computing, Python, React, Machine Learning",Jaipur,B.Com,"7,349.00",in-person,4 months
Web Developer,ICICI SECURITIES PRIMARY DEALERSHIP LIMITED,"React, Python, Data Analysis",Chennai,Diploma,"7,786.00",in-person,6 months
Machine Learning Engineer,WNS GLOBAL SERVICES PRIVATE LIMITED,"DevOps, Cloud Computing",Chennai,BA,"2,875.00",in-person,9 months
IT Support,SKF INDIA LIMITED,"JavaScript, DevOps",Jaipur,BBA,"5,293.00",in-person,3 months
Design Engineer,THDC INDIA LIMITED,"Maintenance, Thermal Power, Power Plant Operations",Pune,BBA,"1,998.00",in-person,7 months
Product Manager,ZYDUS LIFESCIENCES LIMITED,"Sales, Marketing",Pune,B.Sc,"7,640.00",online,12 months
Site Engineer,DALMIA CEMENT (BHARAT) LIMITED,"Surveying, Construction Management, Estimation",Jaipur,Diploma,"7,555.00",online,11 months
Civil Engineer,AARTI INDUSTRIES LTD,"Civil Engineering, Surveying, Project Management, Construction Management",Delhi,BCA,"1,555.00",online,7 months
Software Developer,APARNA INFRAHOUSING PRIVATE LIMITED (PART IX),"Cloud Computing, Machine Learning, Cybersecurity, Java",Jaipur,M.Sc,"3,672.00",online,12 months
Software Developer,FIDELITY BUSINESS SERVICES INDIA PRIVATE LIMITED,"Cybersecurity, Machine Learning, Cloud Computing",Mumbai,BA,"4,406.00",hybrid,12 months
Distribution Executive,MONDELEZ INDIA FOODS PRIVATE LIMITED,"Consumer Insights, Sales, Marketing, Distribution",Delhi,M.Sc,"5,263.00",online,12 months
Consumer Insights Analyst,YASHODA HEALTHCARE SERVICES PRIVATE LIMITED,"Consumer Insights, Product Development, Supply Chain, Distribution",Bangalore,MBA,"7,344.00",online,10 months
Risk Analyst,AXIS BANK LIMITED,"Financial Analysis, Investment Banking, Taxation",Delhi,B.Com,"7,660.00",in-person,2 months
Safety Officer,BRAHMAPUTRA CRACKER AND POLYMER LIMITED,"Structural Design, Surveying",Lucknow,PhD,"4,692.00",in-person,3 months
Web Developer,REC LIMITED,"Data Analysis, DevOps, Java",Mumbai,BCA,"5,091.00",hybrid,11 months
Product Manager,IPCA LABORATORIES LIMITED,"Sales, Supply Chain, Retail Management, Brand Management",Ahmedabad,B.Com,"9,414.00",online,12 months
Retail Manager,PIRAMAL PHARMA LIMITED,"Product Development, Supply Chain, Retail Management",Delhi,B.Sc,"2,284.00",hybrid,10 months
Electrical Engineer,JSW ENERGY LIMITED,"Transmission, Energy Efficiency, Maintenance, Power Plant Operations",Delhi,MBA,"7,647.00",in-person,9 months
DevOps Engineer,SKODA AUTO VOLKSWAGEN INDIA PRIVATE LIMITED,"DevOps, Java",Remote,B.Tech,"5,111.00",hybrid,12 months
Software Developer,WELLS FARGO INTERNATIONAL SOLUTIONS PRIVATE LIMITED,"Data Analysis, React",Delhi,B.Com,"2,933.00",in-person,8 months
Data Analyst,FINOLEX CABLES LIMITED,"Python, Cloud Computing",Bangalore,B.Sc,"3,836.00",online,10 months
IT Support,CROMPTON GREAVES CONSUMER ELECTRICALS LIMITED,"Machine Learning, Python, Cloud Computing",Lucknow,BBA,"5,352.00",online,12 months
Cloud Architect,KAJARIA CERAMICS LIMITED,"React, Java, JavaScript, DevOps",Ahmedabad,BBA,"7,125.00",hybrid,7 months
IT Support,ECGC LIMITED,"Cloud Computing, Java, JavaScript",Pune,BCA,"9,937.00",in-person,3 months
Cloud Architect,COGNIZANT TECHNOLOGY SOLUTIONS INDIA PRIVATE LIMITED,"Data Analysis, DevOps, Machine Learning",Jaipur,BBA,"8,625.00",online,6 months
Financial Analyst,MAX LIFE INSURANCE COMPANY LIMITED,"Financial Modeling, Risk Management, Investment Banking, Taxation",Hyderabad,MBA,"2,348.00",hybrid,9 months
Distribution Executive,DABUR INDIA LIMITED,"Retail Management, Product Development, Sales",Mumbai,B.Sc,"8,027.00",in-person,8 months
Data Analyst,CGI INFORMATION SYSTEMS AND MANAGEMENT CONSULTANTS PRIVATE LIMITED,"Java, React",Jaipur,BA,"6,417.00",hybrid,11 months
Sales Executive,MANKIND PHARMA LIMITED,"Retail Management, Brand Management, Product Development",Pune,B.Com,"6,661.00",hybrid,8 months
Distribution Executive,PI INDUSTRIES LIMITED,"Marketing, Brand Management, Sales",Jaipur,MBA,"3,287.00",online,9 months
Software Developer,BA CONTINUUM INDIA PRIVATE LIMITED,"Cybersecurity, SQL",Jaipur,BA,"1,798.00",hybrid,5 months
QA Engineer,VOLTAS LIMITED,"SQL, Machine Learning",Mumbai,MBA,"4,531.00",hybrid,7 months
Web Developer,INTERNATIONAL TRACTORS LIMITED,"DevOps, React, SQL, Data Analysis",Chennai,BA,"5,957.00",in-person,4 months
Safety Officer,HINDALCO INDUSTRIES LIMITED,"Environmental Compliance, Ore Processing, Safety Management",Delhi,BA,"2,700.00",online,12 months
IT Support,J. P. MORGAN SERVICES INDIA PRIVATE LIMITED,"Cloud Computing, Data Analysis",Pune,B.Com,"9,125.00",hybrid,10 months
Brand Manager,MAHASHIAN DI HATTI PRIVATE LIMITED,"Marketing, Product Development",Kolkata,PhD,"9,441.00",hybrid,8 months
Data Analyst,ACCENTURE SOLUTIONS PRIVATE LIMITED,"Cloud Computing, React",Ahmedabad,M.Sc,"7,961.00",in-person,2 months
Machine Learning Engineer,CORTEVA AGRISCIENCE SEEDS PRIVATE LIMITED,"Java, Cloud Computing, Machine Learning, DevOps",Ahmedabad,PhD,"2,397.00",in-person,5 months
Cloud Architect,SBI CARDS AND PAYMENT SERVICES LIMITED,"JavaScript, Java",Mumbai,M.Sc,"7,136.00",online,4 months
Project Engineer,DEEPAK NITRITE LIMITED,"Estimation, Civil Engineering, Structural Design",Remote,B.Tech,"3,769.00",online,6 months
Marketing Executive,EVEREST FOOD PRODUCTS PRIVATE LIMITED,"Consumer Insights, Brand Management, Product Development, Sales",Hyderabad,BBA,"2,110.00",hybrid,6 months
Marketing Executive,PROCTER & GAMBLE HOME PRODUCTS PRIVATE LIMITED,"Marketing, Brand Management, Retail Management, Supply Chain",Lucknow,PhD,"5,494.00",online,2 months
Credit Analyst,SHRIRAM GENERAL INSURANCE COMPANY LIMITED,"Wealth Management, Financial Modeling, Investment Banking",Jaipur,M.Sc,"5,777.00",in-person,8 months
Mineral Processing Engineer,MAITHAN ALLOYS LTD.,"Exploration, Mineral Processing",Bangalore,B.Tech,"2,188.00",hybrid,7 months
DevOps Engineer,SKF INDIA LIMITED,"DevOps, SQL",Lucknow,B.Com,"5,010.00",online,3 months
Data Analyst,ZEROIDA BROKING LIMITED,"React, Machine Learning, DevOps",Mumbai,BBA,"4,055.00",online,8 months
Thermal Engineer,NUCLEAR POWER CORPORATION OF INDIA LIMITED,"Transmission, Grid Management, Renewable Energy, Electrical Engineering",Pune,Diploma,"7,297.00",hybrid,8 months
Process Engineer,OIL AND NATURAL GAS CORPORATION LIMITED,"Field Operations, Safety Compliance, Reservoir Engineering, Petroleum Engineering",Jaipur,PhD,"6,134.00",hybrid,3 months
Distribution Manager,CONTAINER CORPORATION OF INDIA LIMITED,"Logistics Planning, Inventory Management, Supply Chain Management",Bangalore,B.Com,"8,239.00",in-person,10 months
Safety Officer,WELSPUN LIVING LIMITED,"Construction Management, Quality Control, Civil Engineering",Mumbai,M.Sc,"2,873.00",hybrid,10 months
Construction Manager,AARTI INDUSTRIES LTD,"Safety Management, Estimation, Project Management, Civil Engineering",Ahmedabad,M.Sc,"1,865.00",in-person,4 months
Cloud Architect,CAPGEMINI TECHNOLOGY SERVICES INDIA LIMITED,"React, Java, Python, Cloud Computing",Mumbai,B.Com,"3,134.00",hybrid,3 months
Field Engineer,NUMALIGARH REFINERY LTD,"Reservoir Engineering, Field Operations",Ahmedabad,PhD,"4,777.00",online,4 months
Machine Learning Engineer,VOLTAS LIMITED,"Cybersecurity, React",Jaipur,PhD,"2,862.00",in-person,7 months
Safety Officer,BRAHMAPUTRA CRACKER AND POLYMER LIMITED,"Structural Design, Surveying",Lucknow,PhD,"7,820.00",in-person,5 months
Structural Engineer,WONDER CEMENT LIMITED,"Quality Control, Civil Engineering, Surveying",Chennai,BCA,"2,276.00",hybrid,11 months
IT Support,HONEYWELL TECHNOLOGY SOLUTIONS LAB PRIVATE LIMITED,"Java, Cloud Computing, Python",Delhi,B.Tech,"9,065.00",in-person,4 months
Treasury Analyst,TAMILNAD MERCANTILE BANK LIMITED,"Financial Modeling, Financial Analysis, Risk Management, Investment Banking",Remote,MBA,"3,583.00",online,4 months
Design Engineer,INDIAN ENERGY EXCHANGE LIMITED,"Thermal Power, Transmission, Electrical Engineering, Renewable Energy",Kolkata,M.Sc,"3,528.00",in-person,4 months
Data Analyst,BALRAMPUR CHINI MILLS LTD,"SQL, Cloud Computing",Remote,BBA,"3,790.00",online,6 months
Site Engineer,HEIDELBERGCEMENT INDIA LIMITED.,"Quality Control, Safety Management, Structural Design, Project Management",Hyderabad,PhD,"2,676.00",online,8 months
QA Engineer,CAPGEMINI TECHNOLOGY SERVICES INDIA LIMITED,"DevOps, Cloud Computing, Machine Learning, SQL",Jaipur,PhD,"7,894.00",hybrid,11 months
Ore Processing Technician,MAHANADI COALFIELDS LIMITED,"Exploration, Mineral Processing, Geology",Chennai,Diploma,"5,881.00",online,5 months
Supply Chain Analyst,UNITED SPIRITS LIMITED,"Consumer Insights, Brand Management",Jaipur,B.Tech,"4,760.00",hybrid,10 months
Machine Learning Engineer,FINOLEX CABLES LIMITED,"SQL, DevOps",Mumbai,B.Com,"9,630.00",online,2 months
Product Manager,RSPL LIMITED,"Sales, Consumer Insights, Marketing",Pune,BA,"3,219.00",in-person,11 months
IT Support,INFOSYS BPM LIMITED,"Python, Machine Learning, React",Remote,MBA,"6,411.00",in-person,11 months
Surveyor,DECCAN FINE CHEMICALS (INDIA) PRIVATE LIMITED,"Safety Management, Surveying, Project Management, Construction Management",Bangalore,BCA,"6,958.00",in-person,7 months
Grid Engineer,POWER GRID CORPORATION OF INDIA LIMITED,"Thermal Power, Renewable Energy, Electrical Engineering",Delhi,B.Tech,"3,815.00",in-person,6 months
Web Developer,DXC TECHNOLOGY INDIA PRIVATE LIMITED,"Python, Cybersecurity, Java, DevOps",Jaipur,Diploma,"4,454.00",hybrid,12 months
Software Developer,SMFG INDIA CREDIT COMPANY LIMITED,"Cybersecurity, React, SQL, Data Analysis",Bangalore,MBA,"3,034.00",in-person,4 months
Geologist,GUJARAT STATE PETRONET LIMITED,"Reservoir Engineering, Pipeline Maintenance, Petroleum Engineering",Remote,B.Com,"9,811.00",in-person,12 months
