internship_title,internship_company,required_skills,internship_location,required_education
IT Support,TATA SONS PRIVATE LIMITED,"Java, Data Analysis, Cloud Computing",Ahmedabad,MBA
Environmental Officer,JSW STEEL LIMITED,"Mineral Processing, Geology",Delhi,PhD
Machine Learning Engineer,ADITYA BIRLA FINANCE LIMITED,"Cybersecurity, DevOps, JavaScript, Cloud Computing",Mumbai,B.Tech
Data Analyst,NOKIA SOLUTIONS AND NETWORKS INDIA PRIVATE LIMITED,"RF Engineering, Optical Fiber",Hyderabad,MBA
IT Support,J. P. MORGAN SERVICES INDIA PRIVATE LIMITED,"Cloud Computing, Data Analysis",Pune,B.Com
Environmental Officer,PRAKASH INDUSTRIES LIMITED,"Ore Processing, Safety Management",Bangalore,MBA
Civil Engineer,WONDER CEMENT LIMITED,"Project Management, Quality Control, Safety Management",Mumbai,MBA
Web Developer,INFOSYS LIMITED,"Java, Data Analysis, React",Delhi,BCA
DevOps Engineer,ORACLE INDIA PRIVATE LIMITED,"DevOps, Java, Data Analysis, SQL",Chennai,B.Sc
Credit Analyst,CITY UNION BANK LIMITED,"Financial Analysis, Financial Modeling, Investment Banking, Wealth Management",Jaipur,M.Sc
Risk Analyst,TAMILNAD MERCANTILE BANK LIMITED,"Financial Modeling, Taxation",Pune,MBA
Data Analyst,SBI FUNDS MANAGEMENT LIMITED,"DevOps, Machine Learning",Bangalore,M.Sc
Civil Engineer,AARTI INDUSTRIES LTD,"Civil Engineering, Surveying, Project Management, Construction Management",Delhi,BCA
Distribution Executive,UPL LIMITED,"Brand Management, Consumer Insights, Distribution, Marketing",Bangalore,B.Tech
DevOps Engineer,JAQUAR AND COMPANY PRIVATE LIMITED,"JavaScript, Cybersecurity",Pune,B.Sc
Hardware Engineer,SAMSUNG INDIA ELECTRONICS PRIVATE LIMITED,"Testing, Circuit Design, R&D, Quality Control",Pune,MBA
Software Developer,CGI INFORMATION SYSTEMS AND MANAGEMENT CONSULTANTS PRIVATE LIMITED,"DevOps, JavaScript, Data Analysis, Cloud Computing",Bangalore,BBA
Mineral Processing Engineer,AIA ENGINEERING LIMITED,"Mineral Processing, Exploration",Ahmedabad,M.Sc
Cloud Architect,HAVELLS INDIA LIMITED,"JavaScript, React, Machine Learning",Pune,B.Com
Supply Chain Analyst,PATANJALI FOODS LIMITED,"Supply Chain, Product Development, Marketing, Consumer Insights",Bangalore,BCA
Financial Analyst,KOTAK MAHINDRA BANK LIMITED,"Investment Banking, Financial Modeling, Accounting, Auditing",Delhi,Diploma
Surveyor,THE SUPREME INDUSTRIES LIMITED,"Quality Control, Surveying, Construction Management, Safety Management",Hyderabad,B.Sc
Brand Manager,ABBOTT INDIA LIMITED,"Consumer Insights, Retail Management, Sales",Ahmedabad,MBA
Web Developer,INTERNATIONAL TRACTORS LIMITED,"DevOps, React, SQL, Data Analysis",Chennai,BA
Web Developer,TOYOTA KIRLOSKAR MOTOR PRIVATE LIMITED,"Data Analysis, DevOps",Kolkata,B.Sc
Data Analyst,ACCENTURE SOLUTIONS PRIVATE LIMITED,"Cloud Computing, React",Ahmedabad,M.Sc
Machine Learning Engineer,STAR INDIA PRIVATE LIMITED,"Cybersecurity, React",Mumbai,BA
Web Developer,MRF LIMITED,"Java, Python, Cloud Computing",Lucknow,BCA
IT Support,SKF INDIA LIMITED,"JavaScript, DevOps",Jaipur,BBA
Data Analyst,PIRAMAL CAPITAL & HOUSING FINANCE LIMITED,"React, Python, Cybersecurity",Delhi,Diploma
IT Support,TECH MAHINDRA LIMITED,"SQL, Machine Learning, Python",Jaipur,B.Com
Data Analyst,ZEROIDA BROKING LIMITED,"React, Machine Learning, DevOps",Mumbai,BBA
Data Analyst,FINOLEX CABLES LIMITED,"Python, Cloud Computing",Bangalore,B.Sc
Structural Engineer,PATAKA INDUSTRIES PRIVATE LIMITED,"Estimation, Project Management",Lucknow,BA
Site Engineer,ATUL LIMITED,"Estimation, Surveying",Pune,B.Com
Process Engineer,OIL AND NATURAL GAS CORPORATION LIMITED,"Field Operations, Safety Compliance, Reservoir Engineering, Petroleum Engineering",Jaipur,PhD
IT Support,ICICI SECURITIES PRIMARY DEALERSHIP LIMITED,"JavaScript, SQL",Bangalore,B.Com
Data Analyst,MICROSOFT INDIA (R&D) PRIVATE LIMITED,"Cloud Computing, SQL",Remote,BA
Environmental Officer,AIA ENGINEERING LIMITED,"Mineral Processing, Exploration",Lucknow,Diploma
Cloud Architect,EDGEVERVE SYSTEMS LIMITED,"Cloud Computing, DevOps, Java",Jaipur,Diploma
Site Engineer,WONDER CEMENT LIMITED,"Civil Engineering, Structural Design",Ahmedabad,B.Sc
Civil Engineer,GHCL LIMITED,"Project Management, Civil Engineering, Structural Design, Surveying",Chennai,BCA
Maintenance Engineer,WINSOL SOLAR FIELDS (POLEPALLY) PRIVATE LIMITED,"Maintenance, Energy Efficiency, Power Plant Operations",Mumbai,BBA
Civil Engineer,PKC INFRATECH LIMITED,"Estimation, Structural Design, Surveying, Quality Control",Hyderabad,B.Com
Reservoir Engineer,BHARAT PETROLEUM CORPORATION LIMITED,"Refining, Reservoir Engineering, Geology, Safety Compliance",Pune,PhD
IT Support,ENDURANCE TECHNOLOGIES LIMITED,"Java, SQL, Python, JavaScript",Kolkata,MBA
Drilling Engineer,MAHANAGAR GAS LIMITED,"Petroleum Engineering, Pipeline Maintenance, Safety Compliance",Kolkata,BCA
Machine Learning Engineer,POWER FINANCE CORPORATION LIMITED,"Machine Learning, Data Analysis",Bangalore,M.Sc
IT Support,ENDURANCE TECHNOLOGIES LIMITED,"Java, SQL, Python, JavaScript",Kolkata,MBA
Safety Officer,INDIAN METALS AND FERRO ALLOYS LTD.,"Surveying, Mining Engineering",Remote,BA
Petroleum Engineer,GAIL (INDIA) LIMITED,"Safety Compliance, Reservoir Engineering, Refining, Pipeline Maintenance",Remote,B.Com
Surveyor,IREL (INDIA) LIMITED,"Safety Management, Geology",Bangalore,MBA
Consumer Insights Analyst,NIRMA LIMITED,"Product Development, Marketing",Remote,PhD
Cloud Architect,VENCO RESEARCH AND BREEDING FARM PRIVATE LIMITED,"DevOps, Python, React",Pune,BCA
Data Analyst,MICROSOFT INDIA (R&D) PRIVATE LIMITED,"Cloud Computing, SQL",Remote,BA
Surveyor,ARCELORMITTAL NIPPON STEEL INDIA LIMITED,"Mineral Processing, Geology, Surveying, Mining Engineering",Pune,BCA
Safety Officer,KARNATAKA RURAL INFRASTRUCTURE DEVELOPMENT LIMITED,"Structural Design, Construction Management, Estimation",Delhi,B.Tech
Geologist,JSW STEEL COATED PRODUCTS LIMITED,"Surveying, Mineral Processing, Ore Processing",Pune,BA
Safety Officer,INDRAPRASTHA GAS LIMITED,"Reservoir Engineering, Pipeline Maintenance, Refining, Geology",Hyderabad,B.Com
Product Manager,ABBOTT INDIA LIMITED,"Product Development, Distribution, Retail Management, Marketing",Chennai,PhD
Cloud Architect,ADITYA BIRLA FINANCE LIMITED,"Cybersecurity, Java, React, Data Analysis",Delhi,M.Sc
Machine Learning Engineer,ORACLE FINANCIAL SERVICES SOFTWARE LIMITED,"Data Analysis, Machine Learning, React",Mumbai,BBA
Design Engineer,ADANI POWER LIMITED,"Transmission, Maintenance",Mumbai,BCA
QA Engineer,BAGMANE DEVELOPERS PRIVATE LIMITED,"Cybersecurity, Machine Learning, Cloud Computing, Java",Bangalore,PhD
Project Engineer,THE ASSOCIATED BUILDING COMPANY LIMITED,"Project Management, Structural Design, Civil Engineering",Remote,Diploma
Risk Analyst,AXIS BANK LIMITED,"Financial Analysis, Investment Banking, Taxation",Delhi,B.Com
IT Support,ENDURANCE TECHNOLOGIES LIMITED,"Java, SQL, Python, JavaScript",Kolkata,MBA
Mining Engineer,JINDAL SAW LIMITED,"Mining Engineering, Environmental Compliance",Delhi,B.Sc
Marketing Executive,PROCTER & GAMBLE HOME PRODUCTS PRIVATE LIMITED,"Marketing, Brand Management, Retail Management, Supply Chain",Lucknow,PhD
Cloud Architect,HAVELLS INDIA LIMITED,"JavaScript, React, Machine Learning",Pune,B.Com
Software Developer,ATRIA CONVERGENCE TECHNOLOGIES LIMITED,"Python, Cloud Computing",Chennai,B.Sc
Financial Analyst,BAJAJ ALLIANZ GENERAL INSURANCE COMPANY LIMITED,"Financial Modeling, Wealth Management, Investment Banking",Pune,BBA
Web Developer,INFOSYS LIMITED,"Java, Data Analysis, React",Delhi,BCA
Distribution Executive,PROCTER & GAMBLE HOME PRODUCTS PRIVATE LIMITED,"Brand Management, Marketing, Product Development, Distribution",Bangalore,MBA
Site Engineer,SAINT-GOBAIN INDIA PRIVATE LIMITED,"Project Management, Estimation, Surveying",Mumbai,B.Tech
Product Manager,ABBOTT INDIA LIMITED,"Product Development, Distribution, Retail Management, Marketing",Chennai,PhD
IT Support,MUSIGMA BUSINESS SOLUTIONS PRIVATE LIMITED,"SQL, DevOps",Remote,M.Sc
Relationship Manager,RBL BANK LIMITED,"Risk Management, Auditing, Taxation, Financial Modeling",Hyderabad,MBA
Mineral Processing Engineer,MAHANADI COALFIELDS LIMITED,"Geology, Safety Management, Mining Engineering, Ore Processing",Kolkata,B.Sc
Machine Learning Engineer,ESCORTS KUBOTA LIMITED,"Machine Learning, Data Analysis, Python, SQL",Chennai,BBA
Network Engineer,BHARTI TELEMEDIA LIMITED,"Wireless Communication, IoT, RF Engineering, Network Engineering",Chennai,B.Tech
Mining Engineer,ARCELORMITTAL NIPPON STEEL INDIA LIMITED,"Exploration, Mineral Processing",Jaipur,BCA
Safety Officer,GUJARAT GAS LIMITED,"Field Operations, Refining, Reservoir Engineering",Mumbai,BBA
Construction Manager,DEEPAK NITRITE LIMITED,"Construction Management, Estimation",Mumbai,Diploma
Credit Analyst,TATA AIG GENERAL INSURANCE COMPANY LIMITED,"Taxation, Financial Analysis, Investment Banking, Loan Processing",Remote,Diploma
Marketing Executive,EVEREST FOOD PRODUCTS PRIVATE LIMITED,"Product Development, Brand Management",Pune,B.Tech
Distribution Executive,MONDELEZ INDIA FOODS PRIVATE LIMITED,"Consumer Insights, Sales, Marketing, Distribution",Delhi,M.Sc
DevOps Engineer,SOCIETE GENERALE SECURITIES INDIA PRIVATE LIMITED,"Java, Python, React",Delhi,MBA
Cloud Architect,SBI CARDS AND PAYMENT SERVICES LIMITED,"JavaScript, Java",Mumbai,M.Sc
Supply Chain Analyst,UNITED SPIRITS LIMITED,"Consumer Insights, Brand Management",Jaipur,B.Tech
Sales Executive,ADANI WILMAR LIMITED,"Distribution, Product Development",Bangalore,B.Sc
Grid Engineer,POWER GRID CORPORATION OF INDIA LIMITED,"Thermal Power, Renewable Energy, Electrical Engineering",Delhi,B.Tech
Surveyor,ODISHA MINING CORPORATION LIMITED,"Mineral Processing, Mining Engineering, Geology",Kolkata,B.Com
IT Support,HSBC ELECTRONIC DATA PROCESSING INDIA PRIVATE LIMITED,"Machine Learning, React, Python, DevOps",Chennai,BCA
Sales Executive,AJANTA PHARMA LIMITED,"Consumer Insights, Sales",Lucknow,M.Sc
Web Developer,TOYOTA KIRLOSKAR MOTOR PRIVATE LIMITED,"Data Analysis, React, JavaScript",Hyderabad,BCA
Ore Processing Technician,ORISSA METALIKS PRIVATE LIMITED,"Ore Processing, Geology",Hyderabad,B.Com
Machine Learning Engineer,KANSAI NEROLAC PAINTS LIMITED,"SQL, Cloud Computing",Pune,BCA
Data Analyst,INFO EDGE (INDIA) LIMITED,"SQL, Machine Learning, Java, DevOps",Lucknow,BBA
QA Engineer,KOTAK SECURITIES LIMITED,"React, DevOps",Bangalore,Diploma
Data Analyst,BALRAMPUR CHINI MILLS LTD,"SQL, Cloud Computing",Remote,BBA
System Integrator,STERLITE TECHNOLOGIES LIMITED,"5G Technology, Optical Fiber",Remote,Diploma
Financial Analyst,MAX LIFE INSURANCE COMPANY LIMITED,"Taxation, Auditing, Investment Banking, Financial Modeling",Chennai,BBA
Supply Chain Analyst,MICRO LABS LIMITED,"Supply Chain, Product Development, Retail Management",Hyderabad,Diploma
Surveyor,RASHMI CEMENT LIMITED,"Surveying, Estimation, Quality Control, Structural Design",Jaipur,BCA
Product Manager,SUVEN PHARMACEUTICALS LIMITED,"Consumer Insights, Retail Management, Supply Chain",Remote,B.Sc
Field Engineer,GUJARAT STATE PETRONET LIMITED,"Reservoir Engineering, Drilling Operations, Field Operations",Kolkata,Diploma
Distribution Executive,DABUR INDIA LIMITED,"Retail Management, Product Development, Sales",Mumbai,B.Sc
QA Engineer,GENPACT INDIA PRIVATE LIMITED,"JavaScript, SQL, Machine Learning",Hyderabad,BBA
DevOps Engineer,CITICORP SERVICES INDIA PRIVATE LIMITED,"Python, Cybersecurity, Java",Remote,BCA
Project Engineer,THE ASSOCIATED BUILDING COMPANY LIMITED,"Quality Control, Estimation",Ahmedabad,BA
Sales Executive,MANKIND PHARMA LIMITED,"Retail Management, Brand Management, Product Development",Pune,B.Com
Software Developer,CUMMINS INDIA LIMITED,"Cloud Computing, Data Analysis",Ahmedabad,PhD
Product Manager,PROCTER & GAMBLE HOME PRODUCTS PRIVATE LIMITED,"Consumer Insights, Marketing, Product Development",Bangalore,BBA
Product Manager,GLAND PHARMA LTD,"Marketing, Distribution, Supply Chain, Retail Management",Ahmedabad,B.Com
Cloud Architect,VENCO RESEARCH AND BREEDING FARM PRIVATE LIMITED,"DevOps, Python, React",Pune,BCA
Structural Engineer,KNR CONSTRUCTIONS LIMITED,"Safety Management, Surveying, Civil Engineering, Project Management",Remote,MBA
Cloud Architect,KARNAVATI AVIATION PRIVATE LIMITED,"SQL, Java, DevOps",Ahmedabad,BA
Web Developer,DELL INTERNATIONAL SERVICES INDIA PRIVATE LIMITED,"JavaScript, DevOps",Kolkata,B.Sc
Consumer Insights Analyst,APOLLO HOSPITALS ENTERPRISE LIMITED,"Marketing, Product Development",Mumbai,BCA
Quality Inspector,THE SUPREME INDUSTRIES LIMITED,"Civil Engineering, Construction Management, Safety Management, Structural Design",Pune,BBA
Construction Manager,MSPL LIMITED,"Construction Management, Estimation, Civil Engineering",Lucknow,B.Tech
Safety Officer,FINOLEX INDUSTRIES LIMITED,"Civil Engineering, Safety Management, Estimation, Construction Management",Delhi,M.Sc
Construction Manager,MODERN ROAD MAKERS P LTD,"Construction Management, Quality Control, Surveying",Chennai,Diploma
IT Support,VENCO RESEARCH AND BREEDING FARM PRIVATE LIMITED,"JavaScript, Cybersecurity, Python, Machine Learning",Delhi,B.Sc
Data Analyst,BAJAJ HOUSING FINANCE LIMITED,"DevOps, Python, Java, Data Analysis",Jaipur,B.Tech
DevOps Engineer,AMARA RAJA ENERGY & MOBILITY LIMITED,"Data Analysis, Cybersecurity, Cloud Computing",Kolkata,B.Sc
Marketing Executive,EVEREST FOOD PRODUCTS PRIVATE LIMITED,"Product Development, Brand Management",Pune,B.Tech
Exploration Geologist,NATIONAL ALUMINIUM CO LTD,"Geology, Mining Engineering, Exploration, Surveying",Delhi,MBA
Project Engineer,SHREE RAMKRISHNA EXPORTS PRIVATE LIMITED,"Construction Management, Quality Control, Surveying, Safety Management",Kolkata,Diploma
Web Developer,EDELWEISS ASSET RECONSTRUCTION COMPANY LIMITED,"SQL, DevOps, Java",Delhi,PhD
Software Developer,BAJAJ HOLDINGS & INVESTMENT LIMITED.,"DevOps, Python, Data Analysis, Cloud Computing",Lucknow,Diploma
Sales Executive,AVENUE SUPERMARTS LIMITED,"Distribution, Sales",Jaipur,Diploma
IT Support,MUSIGMA BUSINESS SOLUTIONS PRIVATE LIMITED,"SQL, DevOps",Remote,M.Sc
Data Analyst,INGRAM MICRO INDIA PRIVATE LIMITED,"React, Machine Learning, DevOps, Java",Mumbai,BBA
Web Developer,PERSISTENT SYSTEMS LIMITED,"Cloud Computing, React, Java, Cybersecurity",Remote,BCA
Brand Manager,GLENMARK PHARMACEUTICALS LIMITED,"Brand Management, Marketing, Product Development, Distribution",Kolkata,BA
Construction Manager,AARTI INDUSTRIES LTD,"Safety Management, Estimation, Project Management, Civil Engineering",Ahmedabad,M.Sc
QA Engineer,ZEE ENTERTAINMENT ENTERPRISES LIMITED,"Java, Cloud Computing, React",Remote,Diploma
Surveyor,ARCELORMITTAL NIPPON STEEL INDIA LIMITED,"Mineral Processing, Geology, Surveying, Mining Engineering",Pune,BCA
Exploration Geologist,AIA ENGINEERING LIMITED,"Surveying, Exploration",Hyderabad,BCA
DevOps Engineer,DELOITTE CONSULTING INDIA PRIVATE LIMITED,"Java, Python, JavaScript, Machine Learning",Mumbai,B.Com
Sales Executive,AJANTA PHARMA LIMITED,"Consumer Insights, Sales",Lucknow,M.Sc
IT Support,NOVATEUR ELECTRICAL & DIGITAL SYSTEMS PRIVATE LIMITED,"Cloud Computing, Machine Learning",Kolkata,B.Tech
Civil Engineer,BRAHMAPUTRA CRACKER AND POLYMER LIMITED,"Estimation, Surveying",Delhi,MBA
Consumer Insights Analyst,USV PRIVATE LIMITED,"Supply Chain, Distribution, Product Development",Remote,B.Tech
Supply Chain Analyst,ADANI PORTS AND SPECIAL ECONOMIC ZONE LIMITED,"Freight Management, Procurement, Transportation, Warehouse Operations",Pune,B.Sc
Software Developer,TOPCON SOKKIA INDIA PRIVATE LIMITED,"Machine Learning, Data Analysis, SQL",Pune,PhD
Machine Learning Engineer,GODREJ SEEDS & GENETICS LIMITED,"React, DevOps, Machine Learning",Ahmedabad,B.Tech
Supply Chain Analyst,PARLE BISCUITS PRIVATE LIMITED,"Supply Chain, Marketing, Distribution, Brand Management",Pune,B.Tech
Network Engineer,INDUS TOWERS LIMITED,"Optical Fiber, Wireless Communication",Lucknow,MBA
Distribution Executive,MONDELEZ INDIA FOODS PRIVATE LIMITED,"Brand Management, Consumer Insights, Supply Chain, Product Development",Ahmedabad,Diploma
Environmental Officer,AIA ENGINEERING LIMITED,"Mineral Processing, Exploration",Lucknow,Diploma
Environmental Officer,TATA STEEL LIMITED,"Geology, Ore Processing",Pune,BBA
IT Support,STANDARD CHARTERED GLOBAL BUSINESS SERVICES PRIVATE LIMITED,"Cloud Computing, Python, Cybersecurity",Lucknow,B.Com
Data Analyst,WNS GLOBAL SERVICES PRIVATE LIMITED,"Python, React, Java",Hyderabad,B.Com
Surveyor,BIOP STEELS & POWER PRIVATE LIMITED,"Geology, Surveying",Jaipur,BA
Risk Analyst,TAMILNAD MERCANTILE BANK LIMITED,"Financial Modeling, Taxation",Pune,MBA
Surveyor,ARCELORMITTAL NIPPON STEEL INDIA LIMITED,"Mineral Processing, Geology, Surveying, Mining Engineering",Pune,BCA
DevOps Engineer,REDINGTON LIMITED,"Machine Learning, Cybersecurity",Jaipur,PhD
Project Engineer,GAWAR CONSTRUCTION LIMITED.,"Project Management, Construction Management, Safety Management, Structural Design",Chennai,B.Sc
QA Engineer,GOOGLE IT SERVICES INDIA PRIVATE LIMITED,"Machine Learning, Java, DevOps",Kolkata,B.Com
Power Plant Operator,TANJORE POWER LIMITED,"Energy Efficiency, Thermal Power",Chennai,MBA
QA Engineer,POLYCAB INDIA LIMITED,"SQL, Cybersecurity, DevOps",Remote,Diploma
Environmental Officer,NORTHERN COALFIELDS LIMITED,"Exploration, Geology, Surveying, Safety Management",Chennai,MBA
Safety Officer,OIL INDIA LIMITED,"Pipeline Maintenance, Reservoir Engineering, Field Operations",Chennai,MBA
Transportation Specialist,ADANI HARBOUR SERVICES LIMITED,"Supply Chain Management, Warehouse Operations, Transportation",Mumbai,M.Sc
QA Engineer,CAPGEMINI TECHNOLOGY SERVICES INDIA LIMITED,"DevOps, Cloud Computing, Machine Learning, SQL",Jaipur,PhD
DevOps Engineer,WIPRO ENTERPRISES PRIVATE LIMITED,"Python, Machine Learning, SQL",Mumbai,BCA
IT Support,INFOSYS LIMITED,"SQL, DevOps, Cloud Computing, Cybersecurity",Ahmedabad,B.Com
Consumer Insights Analyst,ALKEM LABORATORIES LIMITED,"Consumer Insights, Distribution, Brand Management, Retail Management",Pune,Diploma
Safety Officer,WESTERN COALFIELDS LIMITED,"Surveying, Ore Processing",Chennai,M.Sc
Ore Processing Technician,MAHANADI COALFIELDS LIMITED,"Exploration, Mineral Processing, Geology",Chennai,Diploma
Web Developer,HDFC SECURITIES LIMITED,"Python, JavaScript, React, DevOps",Chennai,PhD
Data Analyst,ICICI PRUDENTIAL ASSET MANAGEMENT COMPANY LIMITED,"Cloud Computing, Java, DevOps, Data Analysis",Delhi,Diploma
Software Developer,PRESTIGE ESTATES PROJECTS LIMITED,"Cybersecurity, Java, SQL",Pune,B.Com
Surveyor,MSPL LIMITED,"Estimation, Structural Design",Jaipur,MBA
Network Engineer,INDUS TOWERS LIMITED,"Optical Fiber, Wireless Communication",Lucknow,MBA
Construction Manager,G R INFRAPROJECTS LIMITED,"Estimation, Structural Design, Construction Management, Quality Control",Mumbai,B.Tech
Civil Engineer,GHCL LIMITED,"Structural Design, Estimation",Ahmedabad,M.Sc
IT Support,TATA CAPITAL HOUSING FINANCE LIMITED,"Cloud Computing, JavaScript",Hyderabad,BA
IT Support,ECGC LIMITED,"Cloud Computing, Java, JavaScript",Pune,BCA
IT Support,NOVATEUR ELECTRICAL & DIGITAL SYSTEMS PRIVATE LIMITED,"Cloud Computing, Machine Learning",Kolkata,B.Tech
Exploration Geologist,JINDAL ALUMINIUM LIMITED,"Ore Processing, Exploration, Geology",Hyderabad,B.Com
Grid Engineer,JSW ENERGY (BARMER) LIMITED,"Transmission, Thermal Power, Energy Efficiency",Chennai,BCA
Web Developer,COCHIN SHIPYARD LIMITED,"JavaScript, Java, Cloud Computing",Bangalore,Diploma
QA Engineer,MUTHOOT FINANCE LIMITED,"Data Analysis, SQL, JavaScript, Cybersecurity",Bangalore,BCA
Renewable Energy Specialist,ADANI TRANSMISSION (INDIA) LIMITED,"Grid Management, Maintenance, Electrical Engineering, Power Plant Operations",Jaipur,BBA
Safety Officer,WESTERN COALFIELDS LIMITED,"Surveying, Ore Processing",Chennai,M.Sc
Sales Executive,BHARAT BIOTECH INTERNATIONAL LIMITED,"Sales, Retail Management",Chennai,B.Sc
Environmental Officer,NORTHERN COALFIELDS LIMITED,"Exploration, Geology, Surveying, Safety Management",Chennai,MBA
Marketing Executive,HERBALIFE INTERNATIONAL INDIA PRIVATE LIMITED,"Distribution, Brand Management, Product Development",Jaipur,BCA
Sales Executive,GRANULES INDIA LIMITED,"Supply Chain, Distribution, Brand Management, Product Development",Jaipur,BBA
Surveyor,ASHOKA BUILDCON LIMITED,"Safety Management, Surveying",Mumbai,B.Com
Web Developer,DELL INTERNATIONAL SERVICES INDIA PRIVATE LIMITED,"JavaScript, DevOps",Kolkata,B.Sc
Supply Chain Analyst,RSPL LIMITED,"Supply Chain, Consumer Insights",Kolkata,B.Tech
Data Analyst,ADOBE SYSTEMS INDIA PRIVATE LIMITED,"Cloud Computing, JavaScript, Python",Delhi,BBA
Mining Engineer,MOIL LIMITED,"Exploration, Mining Engineering",Mumbai,PhD
Cloud Architect,MPHASIS LIMITED,"JavaScript, React, Java, Cloud Computing",Mumbai,PhD
Cloud Architect,ICICI PRUDENTIAL ASSET MANAGEMENT COMPANY LIMITED,"Cloud Computing, React, Cybersecurity",Pune,MBA
Sales Executive,BHARAT BIOTECH INTERNATIONAL LIMITED,"Marketing, Supply Chain, Brand Management, Distribution",Mumbai,BA
Safety Officer,GUJARAT GAS LIMITED,"Field Operations, Refining, Reservoir Engineering",Mumbai,BBA
Sales Executive,DR.REDDY S LABORATORIES LTD,"Product Development, Consumer Insights, Distribution, Supply Chain",Lucknow,B.Sc
Civil Engineer,GHCL LIMITED,"Structural Design, Estimation",Ahmedabad,M.Sc
Software Developer,MUSIGMA BUSINESS SOLUTIONS PRIVATE LIMITED,"Cybersecurity, JavaScript, Machine Learning",Lucknow,B.Com
Distribution Manager,SIKKA PORTS & TERMINALS LIMITED,"Warehouse Operations, Logistics Planning, Transportation, Inventory Management",Bangalore,BA
Structural Engineer,TRIDENT LIMITED,"Safety Management, Surveying, Quality Control, Estimation",Lucknow,Diploma
DevOps Engineer,ENDURANCE TECHNOLOGIES LIMITED,"Python, Cloud Computing, SQL, Data Analysis",Hyderabad,PhD
Marketing Executive,EVEREST FOOD PRODUCTS PRIVATE LIMITED,"Product Development, Brand Management",Pune,B.Tech
DevOps Engineer,CITICORP SERVICES INDIA PRIVATE LIMITED,"Python, Cybersecurity, Java",Remote,BCA
IT Support,INFOSYS LIMITED,"SQL, DevOps, Cloud Computing, Cybersecurity",Ahmedabad,B.Com
Retail Manager,LUPIN LIMITED,"Consumer Insights, Brand Management, Retail Management, Product Development",Chennai,BA
Retail Manager,EMCURE PHARMACEUTICALS LIMITED,"Product Development, Brand Management, Sales, Supply Chain",Mumbai,PhD
Sales Executive,RECKITT BENCKISER (INDIA) PRIVATE LIMITED,"Consumer Insights, Retail Management",Hyderabad,M.Sc
Web Developer,DXC TECHNOLOGY INDIA PRIVATE LIMITED,"Python, Cybersecurity, Java, DevOps",Jaipur,Diploma
Petroleum Engineer,ADANI TOTAL GAS LIMITED,"Geology, Field Operations, Pipeline Maintenance",Lucknow,MBA
Software Developer,PRESTIGE ESTATES PROJECTS LIMITED,"Cybersecurity, Java, SQL",Pune,B.Com
Civil Engineer,HEIDELBERGCEMENT INDIA LIMITED.,"Estimation, Project Management, Quality Control, Safety Management",Ahmedabad,B.Tech
Civil Engineer,HEIDELBERGCEMENT INDIA LIMITED.,"Estimation, Project Management, Quality Control, Safety Management",Ahmedabad,B.Tech
Field Engineer,GUJARAT STATE PETRONET LIMITED,"Reservoir Engineering, Drilling Operations, Field Operations",Kolkata,Diploma
Cloud Architect,MACROTECH DEVELOPERS LIMITED,"DevOps, JavaScript",Jaipur,B.Sc
Renewable Energy Specialist,KARNATAKA POWER TRANSMISSION CORPORATION LIMITED,"Energy Efficiency, Renewable Energy, Power Plant Operations",Lucknow,BCA
Cloud Architect,SKODA AUTO VOLKSWAGEN INDIA PRIVATE LIMITED,"React, Data Analysis",Remote,B.Sc
Cloud Architect,INDIAN RAILWAY FINANCE CORPORATION LIMITED,"Java, React, JavaScript, Cloud Computing",Jaipur,BA
Mineral Processing Engineer,PRAKASH INDUSTRIES LIMITED,"Surveying, Safety Management",Chennai,BBA
Construction Manager,RASHMI CEMENT LIMITED,"Civil Engineering, Project Management, Safety Management",Pune,B.Com
Civil Engineer,DALMIA CEMENT (BHARAT) LIMITED,"Estimation, Surveying",Hyderabad,BA
R&D Engineer,HP INDIA SALES PRIVATE LIMITED,"Embedded Systems, Manufacturing, Testing",Chennai,BCA
Project Engineer,J. K. CEMENT LIMITED,"Safety Management, Surveying",Ahmedabad,BBA
Cloud Architect,KANSAI NEROLAC PAINTS LIMITED,"Java, JavaScript",Lucknow,BBA
Data Analyst,SAMMAAN CAPITAL LIMITED,"Cybersecurity, Data Analysis",Lucknow,PhD
Mining Engineer,MOIL LIMITED,"Exploration, Mining Engineering",Mumbai,PhD
IT Support,SOBHA LIMITED,"Cloud Computing, Cybersecurity",Bangalore,B.Com
Structural Engineer,TRIDENT LIMITED,"Safety Management, Surveying, Quality Control, Estimation",Lucknow,Diploma
Construction Manager,GUJARAT FLUOROCHEMICALS LIMITED,"Project Management, Safety Management, Structural Design",Chennai,PhD
Site Engineer,RAIL VIKAS NIGAM LIMITED,"Structural Design, Surveying, Construction Management, Safety Management",Pune,Diploma
Structural Engineer,K.P.R. MILL LIMITED,"Estimation, Safety Management, Construction Management",Pune,B.Tech
QA Engineer,NOVATEUR ELECTRICAL & DIGITAL SYSTEMS PRIVATE LIMITED,"Java, JavaScript, React",Mumbai,M.Sc
Cloud Architect,ADOBE SYSTEMS INDIA PRIVATE LIMITED,"Python, React, SQL, Machine Learning",Chennai,BCA
Distribution Executive,MONDELEZ INDIA FOODS PRIVATE LIMITED,"Consumer Insights, Sales, Marketing, Distribution",Delhi,M.Sc
RF Engineer,ATC TELECOM INFRASTRUCTURE PRIVATE LIMITED,"Data Transmission, RF Engineering",Hyderabad,PhD
QA Engineer,MUTHOOT FINANCE LIMITED,"Data Analysis, SQL, JavaScript, Cybersecurity",Bangalore,BCA
Data Analyst,MICROSOFT INDIA (R&D) PRIVATE LIMITED,"Cloud Computing, SQL",Remote,BA
Mineral Processing Engineer,JSW STEEL LIMITED,"Mining Engineering, Exploration",Lucknow,PhD
Thermal Engineer,NTPC LIMITED,"Renewable Energy, Power Plant Operations",Bangalore,B.Sc
DevOps Engineer,INTEL TECHNOLOGY INDIA PRIVATE LIMITED,"Cybersecurity, React, Python",Bangalore,BBA
QA Engineer,HDB FINANCIAL SERVICES LIMITED,"Java, Python, Machine Learning, Cybersecurity",Kolkata,B.Sc
Product Manager,GODREJ CONSUMER PRODUCTS LIMITED,"Consumer Insights, Marketing",Kolkata,M.Sc
IT Support,GENPACT INDIA PRIVATE LIMITED,"Machine Learning, SQL",Bangalore,B.Sc
Electrical Engineer,JSW ENERGY LIMITED,"Transmission, Energy Efficiency, Maintenance, Power Plant Operations",Delhi,MBA
