internship_title,internship_company,required_skills,internship_location,required_education
Safety Officer,INDIAN METALS AND FERRO ALLOYS LTD.,"Surveying, Mining Engineering",Remote,BA
QA Engineer,COGNIZANT TECHNOLOGY SOLUTIONS INDIA PRIVATE LIMITED,"Data Analysis, Python, React",Pune,M.Sc
Brand Manager,PIRAMAL PHARMA LIMITED,"Marketing, Sales, Consumer Insights",Lucknow,BCA
Hardware Engineer,SAMSUNG INDIA ELECTRONICS PRIVATE LIMITED,"Testing, Circuit Design, R&D, Quality Control",Pune,MBA
Reservoir Engineer,BHARAT PETROLEUM CORPORATION LIMITED,"Refining, Reservoir Engineering, Geology, Safety Compliance",Pune,PhD
Power Plant Operator,NTPC LIMITED,"Electrical Engineering, Grid Management, Transmission",Lucknow,PhD
Site Engineer,GUJARAT ALKALIES AND CHEMICALS LIMITED,"Construction Management, Civil Engineering, Surveying",Lucknow,PhD
Cloud Architect,KARNAVATI AVIATION PRIVATE LIMITED,"SQL, Java, DevOps",Ahmedabad,BA
Machine Learning Engineer,SCHNEIDER ELECTRIC INDIA PRIVATE LIMITED,"Data Analysis, Cybersecurity, SQL, DevOps",Hyderabad,MBA
Surveyor,DECCAN FINE CHEMICALS (INDIA) PRIVATE LIMITED,"Safety Management, Surveying, Project Management, Construction Management",Bangalore,BCA
Field Engineer,GUJARAT STATE PETRONET LIMITED,"Petroleum Engineering, Field Operations",Ahmedabad,B.Sc
Marketing Executive,GLENMARK PHARMACEUTICALS LIMITED,"Product Development, Distribution, Marketing, Retail Management",Delhi,B.Tech
Accountant,INDUSIND BANK LTD.,"Taxation, Financial Analysis, Accounting, Financial Modeling",Hyderabad,B.Sc
Credit Analyst,HDFC LIFE INSURANCE COMPANY LIMITED,"Taxation, Investment Banking, Auditing",Remote,B.Sc
RF Engineer,HUAWEI TELECOMMUNICATIONS (INDIA) COMPANY PRIVATE LIMITED,"Network Engineering, Telecom Infrastructure, IoT, Wireless Communication",Kolkata,Diploma
DevOps Engineer,SCHNEIDER ELECTRIC INDIA PRIVATE LIMITED,"Cybersecurity, SQL, JavaScript, Python",Remote,B.Tech
Construction Manager,DILIP BUILDCON LIMITED,"Quality Control, Civil Engineering",Kolkata,B.Com
Hardware Engineer,HONEYWELL AUTOMATION INDIA LIMITED,"PCB Design, R&D, Quality Control, Circuit Design",Hyderabad,PhD
Cloud Architect,NATIONAL PAYMENTS CORPORATION OF INDIA,"Python, DevOps, Data Analysis",Remote,PhD
Surveyor,JSW STEEL COATED PRODUCTS LIMITED,"Exploration, Surveying",Jaipur,B.Tech
Web Developer,CITIGROUP GLOBAL MARKETS INDIA PRIVATE LIMITED,"Cybersecurity, DevOps, Machine Learning, Data Analysis",Lucknow,BCA
Site Engineer,SHREE CEMENT LIMITED,"Quality Control, Safety Management",Mumbai,MBA
Data Analyst,CHOLAMANDALAM INVESTMENT AND FINANCE COMPANY LIMITED,"Python, React",Remote,BBA
Web Developer,TOYOTA KIRLOSKAR MOTOR PRIVATE LIMITED,"Data Analysis, React, JavaScript",Hyderabad,BCA
QA Engineer,BARCLAYS GLOBAL SERVICE CENTRE PRIVATE LIMITED,"React, DevOps, Cybersecurity",Chennai,B.Com
Safety Officer,WELSPUN LIVING LIMITED,"Construction Management, Quality Control, Civil Engineering",Mumbai,M.Sc
Exploration Geologist,JINDAL ALUMINIUM LIMITED,"Ore Processing, Exploration, Geology",Hyderabad,B.Com
IT Support,INFOSYS LIMITED,"SQL, DevOps, Cloud Computing, Cybersecurity",Ahmedabad,B.Com
Software Developer,PRESTIGE ESTATES PROJECTS LIMITED,"Cybersecurity, Java, SQL",Pune,B.Com
Thermal Engineer,INDIAN RENEWABLE ENERGY DEVELOPMENT AGENCY LIMITED,"Transmission, Electrical Engineering",Mumbai,Diploma
Web Developer,GRASIM INDUSTRIES LTD,"Python, Data Analysis, Java",Delhi,BBA
Safety Officer,INDRAPRASTHA GAS LIMITED,"Reservoir Engineering, Pipeline Maintenance, Refining, Geology",Hyderabad,B.Com
Safety Officer,BHUSHAN POWER & STEEL LIMITED,"Ore Processing, Exploration, Surveying, Environmental Compliance",Remote,B.Com
Machine Learning Engineer,CROMPTON GREAVES CONSUMER ELECTRICALS LIMITED,"React, SQL, Cloud Computing, Python",Remote,B.Sc
Web Developer,SUN TV NETWORK LIMITED,"React, DevOps, Machine Learning",Ahmedabad,B.Tech
Site Engineer,BHILOSA INDUSTRIES PRIVATE LIMITED,"Project Management, Quality Control, Civil Engineering, Safety Management",Chennai,B.Sc
Freight Coordinator,ADANI HAZIRA PORT LIMITED,"Warehouse Operations, Supply Chain Management",Jaipur,B.Sc
Mining Engineer,JINDAL SAW LIMITED,"Mining Engineering, Environmental Compliance",Delhi,B.Sc
Renewable Energy Specialist,NHPC LIMITED,"Power Plant Operations, Electrical Engineering",Mumbai,Diploma
Power Plant Operator,INDIAN ENERGY EXCHANGE LIMITED,"Electrical Engineering, Renewable Energy",Jaipur,BCA
Surveyor,IREL (INDIA) LIMITED,"Safety Management, Geology",Bangalore,MBA
Quality Inspector,THE SUPREME INDUSTRIES LIMITED,"Civil Engineering, Construction Management, Safety Management, Structural Design",Pune,BBA
Quality Inspector,AARTI INDUSTRIES LTD,"Structural Design, Project Management, Estimation",Mumbai,BCA
Safety Officer,WELSPUN LIVING LIMITED,"Construction Management, Quality Control, Civil Engineering",Mumbai,M.Sc
Retail Manager,ITC LIMITED,"Marketing, Sales, Brand Management",Bangalore,MBA
Software Developer,SUPER CASSETTES INDUSTRIES PRIVATE LIMITED,"Data Analysis, Cloud Computing, Java",Delhi,M.Sc
Relationship Manager,DCB BANK LIMITED,"Wealth Management, Financial Modeling, Auditing, Taxation",Jaipur,M.Sc
Quality Inspector,ULTRATECH CEMENT LIMITED,"Construction Management, Quality Control, Surveying",Ahmedabad,BA
QA Engineer,APARNA INFRAHOUSING PRIVATE LIMITED (PART IX),"Cybersecurity, Cloud Computing",Chennai,B.Sc
Product Manager,ZYDUS LIFESCIENCES LIMITED,"Sales, Marketing",Pune,B.Sc
Retail Manager,BRITANNIA INDUSTRIES LTD,"Marketing, Brand Management, Retail Management, Product Development",Mumbai,B.Tech
Loan Officer,AXIS BANK LIMITED,"Taxation, Risk Management, Investment Banking, Wealth Management",Remote,PhD
Software Developer,INFOSYS LIMITED,"Python, Data Analysis, JavaScript, Cybersecurity",Delhi,Diploma
Safety Officer,THE RAMCO CEMENTS LIMITED,"Project Management, Quality Control, Construction Management",Mumbai,BCA
QA Engineer,CGI INFORMATION SYSTEMS AND MANAGEMENT CONSULTANTS PRIVATE LIMITED,"Python, Cloud Computing, SQL, React",Kolkata,B.Tech
Construction Manager,MSPL LIMITED,"Construction Management, Project Management, Safety Management, Civil Engineering",Pune,Diploma
DevOps Engineer,WIPRO ENTERPRISES PRIVATE LIMITED,"Python, Machine Learning, SQL",Mumbai,BCA
Relationship Manager,HDFC BANK LIMITED,"Loan Processing, Financial Modeling, Auditing, Accounting",Mumbai,M.Sc
Credit Analyst,SHRIRAM GENERAL INSURANCE COMPANY LIMITED,"Wealth Management, Financial Modeling, Investment Banking",Jaipur,M.Sc
Project Engineer,GUJARAT STATE FERTILIZERS & CHEMICALS LIMITED,"Structural Design, Project Management",Jaipur,BA
Software Developer,PNB HOUSING FINANCE LIMITED,"SQL, React",Jaipur,BBA
Software Developer,BALKRISHNA INDUSTRIES LIMITED,"Data Analysis, Python",Hyderabad,BA
Credit Analyst,THE FEDERAL BANK LTD,"Investment Banking, Financial Modeling",Mumbai,BBA
Data Analyst,WELLS FARGO INTERNATIONAL SOLUTIONS PRIVATE LIMITED,"Cloud Computing, Java",Lucknow,B.Com
Software Developer,DELL INTERNATIONAL SERVICES INDIA PRIVATE LIMITED,"React, Cloud Computing, Cybersecurity",Remote,B.Tech
Distribution Executive,DIVI S LABORATORIES LIMITED,"Supply Chain, Consumer Insights, Brand Management, Sales",Pune,Diploma
Data Analyst,SAMMAAN CAPITAL LIMITED,"Cybersecurity, Data Analysis",Lucknow,PhD
Consumer Insights Analyst,ALKEM LABORATORIES LIMITED,"Consumer Insights, Distribution, Brand Management, Retail Management",Pune,Diploma
DevOps Engineer,BRAKES INDIA PRIVATE LIMITED,"React, SQL, DevOps",Pune,B.Com
Construction Manager,DILIP BUILDCON LIMITED,"Quality Control, Construction Management",Ahmedabad,M.Sc
Product Manager,MICRO LABS LIMITED,"Retail Management, Supply Chain",Mumbai,BBA
IT Support,J. P. MORGAN SERVICES INDIA PRIVATE LIMITED,"Cloud Computing, Data Analysis",Pune,B.Com
Cloud Architect,FINOLEX CABLES LIMITED,"Python, DevOps, SQL, Machine Learning",Lucknow,BBA
DevOps Engineer,ORACLE INDIA PRIVATE LIMITED,"DevOps, Java, Data Analysis, SQL",Chennai,B.Sc
Construction Manager,G R INFRAPROJECTS LIMITED,"Estimation, Structural Design, Construction Management, Quality Control",Mumbai,B.Tech
QA Engineer,GENPACT INDIA PRIVATE LIMITED,"JavaScript, SQL, Machine Learning",Hyderabad,BBA
Web Developer,REC LIMITED,"Data Analysis, DevOps, Java",Mumbai,BCA
Product Manager,SUVEN PHARMACEUTICALS LIMITED,"Distribution, Retail Management, Sales",Lucknow,PhD
Inventory Analyst,GMR HYDERABAD INTERNATIONAL AIRPORT LIMITED,"Transportation, Supply Chain Management, Procurement, Inventory Management",Bangalore,B.Sc
Safety Officer,WELSPUN LIVING LIMITED,"Construction Management, Quality Control, Civil Engineering",Mumbai,M.Sc
Consumer Insights Analyst,MANKIND PHARMA LIMITED,"Consumer Insights, Marketing",Kolkata,BCA
Software Developer,BOSCH GLOBAL SOFTWARE TECHNOLOGIES PRIVATE LIMITED,"SQL, Java, Cybersecurity, React",Kolkata,BA
Mining Engineer,MOIL LIMITED,"Geology, Ore Processing",Mumbai,BBA
Accountant,INDUSIND BANK LTD.,"Taxation, Financial Analysis, Accounting, Financial Modeling",Hyderabad,B.Sc
DevOps Engineer,TAFE MOTORS AND TRACTORS LIMITED,"Python, JavaScript, Java, Cybersecurity",Pune,B.Sc
Safety Officer,INDRAPRASTHA GAS LIMITED,"Reservoir Engineering, Pipeline Maintenance, Refining, Geology",Hyderabad,B.Com
DevOps Engineer,ORACLE INDIA PRIVATE LIMITED,"DevOps, Java, Data Analysis, SQL",Chennai,B.Sc
QA Engineer,DLF LIMITED,"DevOps, JavaScript",Lucknow,MBA
Exploration Geologist,RUNGTA MINES LIMITED,"Surveying, Mining Engineering, Mineral Processing, Geology",Kolkata,B.Tech
Structural Engineer,SRF LIMITED,"Construction Management, Structural Design, Civil Engineering",Pune,BA
Quality Inspector,THE SUPREME INDUSTRIES LIMITED,"Civil Engineering, Construction Management, Safety Management, Structural Design",Pune,BBA
Treasury Analyst,RBL BANK LIMITED,"Auditing, Taxation",Remote,PhD
Construction Manager,MSPL LIMITED,"Construction Management, Project Management, Safety Management, Civil Engineering",Pune,Diploma
Petroleum Engineer,INDIAN OIL CORPORATION LIMITED,"Geology, Drilling Operations",Delhi,BCA
IT Support,WHIRLPOOL OF INDIA LIMITED,"Java, Cloud Computing, Cybersecurity, React",Delhi,BA
IT Support,EIT SERVICES INDIA PRIVATE LIMITED,"Cybersecurity, SQL, React, Data Analysis",Jaipur,BBA
Software Developer,TATA CAPITAL FINANCIAL SERVICES LIMITED,"SQL, Data Analysis, DevOps",Lucknow,BCA
Machine Learning Engineer,ORACLE INDIA PRIVATE LIMITED,"Machine Learning, React, Data Analysis, Python",Mumbai,MBA
Distribution Executive,EVEREST FOOD PRODUCTS PRIVATE LIMITED,"Marketing, Product Development, Distribution, Consumer Insights",Jaipur,MBA
Grid Engineer,SHYAM SEL AND POWER LIMITED,"Renewable Energy, Thermal Power, Electrical Engineering, Maintenance",Hyderabad,M.Sc
Ore Processing Technician,THRIVENI EARTHMOVERS PRIVATE LIMITED,"Mining Engineering, Safety Management",Bangalore,B.Com
Quality Inspector,SHREE RAMKRISHNA EXPORTS PRIVATE LIMITED,"Civil Engineering, Construction Management, Structural Design",Ahmedabad,B.Tech
Field Engineer,GUJARAT STATE PETRONET LIMITED,"Reservoir Engineering, Drilling Operations, Field Operations",Kolkata,Diploma
Web Developer,HCL TECHNOLOGIES LIMITED,"Data Analysis, Cloud Computing, Python",Pune,B.Com
Web Developer,INDIAN RAILWAY CATERING AND TOURISM CORPORATION LIMITED,"JavaScript, React",Kolkata,M.Sc
Project Engineer,POWER GRID CORPORATION OF INDIA LIMITED,"Renewable Energy, Energy Efficiency",Ahmedabad,PhD
Exploration Geologist,RUNGTA MINES LIMITED,"Surveying, Mining Engineering, Mineral Processing, Geology",Kolkata,B.Tech
IT Support,ICICI SECURITIES PRIMARY DEALERSHIP LIMITED,"JavaScript, SQL",Bangalore,B.Com
Web Developer,DELL INTERNATIONAL SERVICES INDIA PRIVATE LIMITED,"JavaScript, DevOps",Kolkata,B.Sc
Hardware Engineer,SAMSUNG INDIA ELECTRONICS PRIVATE LIMITED,"Testing, Quality Control",Ahmedabad,B.Com
QA Engineer,ZEROIDA BROKING LIMITED,"Cloud Computing, Machine Learning, DevOps",Hyderabad,BCA
Surveyor,CATERPILLAR INDIA PRIVATE LIMITED,"Quality Control, Civil Engineering, Surveying, Estimation",Kolkata,BA
Petroleum Engineer,ADANI TOTAL GAS LIMITED,"Geology, Field Operations, Pipeline Maintenance",Lucknow,MBA
Software Developer,BALKRISHNA INDUSTRIES LIMITED,"Data Analysis, Python",Hyderabad,BA
Project Engineer,D B POWER LIMITED,"Maintenance, Renewable Energy",Hyderabad,B.Tech
Web Developer,BAJAJ FINANCE LIMITED,"DevOps, Machine Learning",Remote,M.Sc
Thermal Engineer,GODAWARI POWER AND ISPAT LIMITED,"Renewable Energy, Electrical Engineering, Power Plant Operations",Bangalore,MBA
Data Analyst,SUNDARAM FINANCE LIMITED,"Python, DevOps, Machine Learning, JavaScript",Delhi,PhD
Civil Engineer,TRIDENT LIMITED,"Civil Engineering, Project Management",Hyderabad,PhD
Reservoir Engineer,BHARAT PETROLEUM CORPORATION LIMITED,"Refining, Reservoir Engineering, Geology, Safety Compliance",Pune,PhD
QA Engineer,KOTAK SECURITIES LIMITED,"React, DevOps",Bangalore,Diploma
IT Support,POLYCAB INDIA LIMITED,"Cybersecurity, Cloud Computing, React, DevOps",Bangalore,PhD
Site Engineer,NHDC LIMITED,"Quality Control, Estimation, Structural Design",Kolkata,MBA
Surveyor,FINOLEX INDUSTRIES LIMITED,"Quality Control, Safety Management, Surveying",Mumbai,BBA
Project Engineer,D B POWER LIMITED,"Maintenance, Renewable Energy",Hyderabad,B.Tech
Software Developer,INFOSYS LIMITED,"Python, Data Analysis, JavaScript, Cybersecurity",Delhi,Diploma
Thermal Engineer,GODAWARI POWER AND ISPAT LIMITED,"Renewable Energy, Electrical Engineering, Power Plant Operations",Bangalore,MBA
Safety Officer,IRCON INTERNATIONAL LIMITED,"Project Management, Structural Design, Estimation",Jaipur,B.Tech
Project Engineer,GAWAR CONSTRUCTION LIMITED.,"Civil Engineering, Structural Design, Project Management, Quality Control",Pune,B.Com
DevOps Engineer,BERGER PAINTS INDIA LIMITED,"React, Machine Learning",Jaipur,Diploma
5G Specialist,HUAWEI TELECOMMUNICATIONS (INDIA) COMPANY PRIVATE LIMITED,"IoT, Network Engineering, Wireless Communication",Hyderabad,B.Com
Credit Analyst,HDFC LIFE INSURANCE COMPANY LIMITED,"Taxation, Investment Banking, Auditing",Remote,B.Sc
Distribution Executive,PROCTER & GAMBLE HOME PRODUCTS PRIVATE LIMITED,"Brand Management, Marketing, Product Development, Distribution",Bangalore,MBA
Surveyor,PRAKASH INDUSTRIES LIMITED,"Mineral Processing, Safety Management",Jaipur,B.Tech
QA Engineer,HYUNDAI MOTOR INDIA LIMITED,"Machine Learning, SQL, JavaScript, DevOps",Chennai,B.Tech
Distribution Executive,EMCURE PHARMACEUTICALS LIMITED,"Marketing, Product Development",Ahmedabad,BA
Software Developer,BA CONTINUUM INDIA PRIVATE LIMITED,"Cybersecurity, SQL",Jaipur,BA
Software Developer,TOPCON SOKKIA INDIA PRIVATE LIMITED,"JavaScript, SQL, Python, DevOps",Remote,BBA
Supply Chain Analyst,UPL LIMITED,"Brand Management, Distribution",Kolkata,B.Sc
IT Support,ASIAN PAINTS LIMITED,"Data Analysis, SQL, Cloud Computing, Machine Learning",Remote,Diploma
Marketing Executive,GODREJ CONSUMER PRODUCTS LIMITED,"Distribution, Product Development, Sales, Marketing",Bangalore,BA
QA Engineer,HYUNDAI MOTOR INDIA LIMITED,"Machine Learning, SQL, JavaScript, DevOps",Chennai,B.Tech
Machine Learning Engineer,KOTAK MAHINDRA PRIME LIMITED,"Cloud Computing, Machine Learning, Java",Ahmedabad,BBA
Quality Inspector,ENGINEERS INDIA LIMITED,"Project Management, Surveying, Construction Management",Ahmedabad,B.Sc
Project Engineer,AMBUJA CEMENTS LIMITED,"Safety Management, Project Management",Chennai,BCA
Safety Officer,ORISSA METALIKS PRIVATE LIMITED,"Environmental Compliance, Surveying",Mumbai,MBA
Site Engineer,BIRLA CARBON INDIA PRIVATE LIMITED,"Surveying, Estimation",Lucknow,BCA
DevOps Engineer,STANDARD CHARTERED GLOBAL BUSINESS SERVICES PRIVATE LIMITED,"Java, React, Machine Learning, Cloud Computing",Lucknow,BA
Structural Engineer,GHARDA CHEMICALS LIMITED,"Construction Management, Structural Design",Chennai,BA
Surveyor,COROMANDEL INTERNATIONAL LIMITED,"Civil Engineering, Construction Management, Safety Management, Project Management",Ahmedabad,M.Sc
Web Developer,BAJAJ FINANCE LIMITED,"DevOps, Machine Learning",Remote,M.Sc
Sales Executive,AVENUE SUPERMARTS LIMITED,"Distribution, Sales",Jaipur,Diploma
Construction Manager,SAINT-GOBAIN INDIA PRIVATE LIMITED,"Quality Control, Safety Management",Chennai,MBA
Treasury Analyst,ICICI PRUDENTIAL LIFE INSURANCE COMPANY LIMITED,"Investment Banking, Taxation, Accounting, Loan Processing",Delhi,Diploma
Machine Learning Engineer,HDFC ASSET MANAGEMENT COMPANY LIMITED,"Python, React",Jaipur,B.Sc
Civil Engineer,HEIDELBERGCEMENT INDIA LIMITED.,"Estimation, Project Management, Quality Control, Safety Management",Ahmedabad,B.Tech
Civil Engineer,NCC LIMITED,"Civil Engineering, Safety Management",Kolkata,BBA
Structural Engineer,KNR CONSTRUCTIONS LIMITED,"Safety Management, Surveying, Civil Engineering, Project Management",Remote,MBA
Civil Engineer,JCB INDIA LIMITED,"Project Management, Construction Management, Structural Design",Remote,B.Com
Construction Manager,RASHMI CEMENT LIMITED,"Civil Engineering, Project Management, Safety Management",Pune,B.Com
Geologist,NAYARA ENERGY LIMITED,"Geology, Reservoir Engineering, Refining, Petroleum Engineering",Hyderabad,Diploma
Safety Officer,PKC INFRATECH LIMITED,"Construction Management, Project Management",Bangalore,PhD
Risk Analyst,TAMILNAD MERCANTILE BANK LIMITED,"Financial Modeling, Taxation",Pune,MBA
Project Engineer,THDC INDIA LIMITED,"Electrical Engineering, Renewable Energy, Power Plant Operations",Chennai,B.Com
QA Engineer,MAHINDRA AND MAHINDRA FINANCIAL SERVICES LIMITED,"DevOps, Machine Learning",Hyderabad,M.Sc
Field Engineer,GUJARAT STATE PETRONET LIMITED,"Reservoir Engineering, Drilling Operations, Field Operations",Kolkata,Diploma
Software Developer,TATA CAPITAL FINANCIAL SERVICES LIMITED,"SQL, Data Analysis, DevOps",Lucknow,BCA
DevOps Engineer,SKF INDIA LIMITED,"DevOps, SQL",Lucknow,B.Com
IT Support,STANDARD CHARTERED GLOBAL BUSINESS SERVICES PRIVATE LIMITED,"Cloud Computing, Python, Cybersecurity",Lucknow,B.Com
IT Support,EIT SERVICES INDIA PRIVATE LIMITED,"Cybersecurity, SQL, React, Data Analysis",Jaipur,BBA
Credit Analyst,CITY UNION BANK LIMITED,"Financial Analysis, Financial Modeling, Investment Banking, Wealth Management",Jaipur,M.Sc
Product Manager,ZYDUS LIFESCIENCES LIMITED,"Sales, Marketing",Pune,B.Sc
Thermal Engineer,TANJORE POWER LIMITED,"Maintenance, Thermal Power, Renewable Energy",Remote,MBA
IT Support,SAMMAAN CAPITAL LIMITED,"React, JavaScript",Delhi,BCA
Drilling Engineer,MANGALORE REFINERY AND PETROCHEMICALS LIMITED,"Safety Compliance, Petroleum Engineering, Drilling Operations, Geology",Jaipur,BCA
Software Developer,FRANKLIN TEMPLETON ASSET MANAGEMENT (INDIA) PRIVATE LIMITED,"React, Java, Machine Learning, Data Analysis",Ahmedabad,M.Sc
Data Analyst,YARDI SOFTWARE INDIA PRIVATE LIMITED,"Java, React, DevOps, Cloud Computing",Mumbai,B.Com
IT Support,MALABAR GOLD LIMITED,"Machine Learning, Data Analysis",Jaipur,PhD
Credit Analyst,HDFC ERGO GENERAL INSURANCE COMPANY LIMITED,"Risk Management, Financial Analysis, Accounting, Investment Banking",Hyderabad,BBA
Site Engineer,APCO INFRATECH PRIVATE LIMITED,"Civil Engineering, Quality Control, Safety Management, Surveying",Lucknow,BBA
Safety Officer,ARCELORMITTAL NIPPON STEEL INDIA LIMITED,"Mining Engineering, Safety Management, Environmental Compliance, Geology",Mumbai,BBA
Safety Officer,WESTERN COALFIELDS LIMITED,"Surveying, Ore Processing",Chennai,M.Sc
Financial Analyst,MAX LIFE INSURANCE COMPANY LIMITED,"Taxation, Auditing, Investment Banking, Financial Modeling",Chennai,BBA
Geologist,HINDUSTAN ZINC LIMITED,"Geology, Exploration, Safety Management, Surveying",Delhi,B.Tech
Network Engineer,BHARTI TELEMEDIA LIMITED,"Wireless Communication, IoT, RF Engineering, Network Engineering",Chennai,B.Tech
Software Developer,INFOSYS LIMITED,"Python, Data Analysis, JavaScript, Cybersecurity",Delhi,Diploma
IT Support,STANDARD CHARTERED GLOBAL BUSINESS SERVICES PRIVATE LIMITED,"Cloud Computing, Python, Cybersecurity",Lucknow,B.Com
Environmental Officer,TATA STEEL LIMITED,"Geology, Ore Processing",Pune,BBA
Software Developer,MAZAGON DOCK SHIPBUILDERS LIMITED,"Data Analysis, SQL",Mumbai,BCA
Cloud Architect,ADOBE SYSTEMS INDIA PRIVATE LIMITED,"Python, React, SQL, Machine Learning",Chennai,BCA
Marketing Executive,PIRAMAL ENTERPRISES LIMITED,"Brand Management, Supply Chain, Consumer Insights, Product Development",Bangalore,BBA
Loan Officer,AXIS BANK LIMITED,"Taxation, Risk Management, Investment Banking, Wealth Management",Remote,PhD
IT Support,TECH MAHINDRA LIMITED,"SQL, Machine Learning, Python",Jaipur,B.Com
Project Engineer,RUNGTA SONS PVT LTD,"Project Management, Safety Management, Quality Control, Civil Engineering",Jaipur,BA
Product Manager,ABBOTT INDIA LIMITED,"Product Development, Distribution, Retail Management, Marketing",Chennai,PhD
Risk Analyst,AXIS BANK LIMITED,"Financial Analysis, Investment Banking, Taxation",Delhi,B.Com
IT Support,MUSIGMA BUSINESS SOLUTIONS PRIVATE LIMITED,"SQL, DevOps",Remote,M.Sc
Consumer Insights Analyst,PROCTER & GAMBLE HYGIENE AND HEALTH CARE LIMITED,"Marketing, Consumer Insights, Supply Chain",Pune,Diploma
IT Support,KIRAN GEMS PRIVATE LIMITED,"DevOps, Data Analysis, Cloud Computing, Java",Jaipur,BA
Marketing Executive,SUN PHARMACEUTICAL INDUSTRIES LIMITED,"Brand Management, Supply Chain, Marketing, Product Development",Jaipur,BA
Distribution Executive,MONDELEZ INDIA FOODS PRIVATE LIMITED,"Consumer Insights, Sales, Marketing, Distribution",Delhi,M.Sc
Sales Executive,GRANULES INDIA LIMITED,"Supply Chain, Distribution, Brand Management, Product Development",Jaipur,BBA
Ore Processing Technician,THRIVENI EARTHMOVERS PRIVATE LIMITED,"Mining Engineering, Safety Management",Bangalore,B.Com
Web Developer,ATRIA CONVERGENCE TECHNOLOGIES LIMITED,"Cybersecurity, SQL",Delhi,B.Sc
DevOps Engineer,RELIANCE INDUSTRIES LIMITED,"Cloud Computing, Python, React, Machine Learning",Jaipur,B.Com
Reservoir Engineer,HPCL-MITTAL ENERGY LIMITED,"Geology, Pipeline Maintenance, Reservoir Engineering",Chennai,MBA
QA Engineer,WIPRO ENTERPRISES PRIVATE LIMITED,"Machine Learning, Data Analysis",Remote,B.Sc
Electronics Engineer,HP INDIA SALES PRIVATE LIMITED,"Manufacturing, Embedded Systems, R&D",Hyderabad,PhD
Project Engineer,TATA POWER DELHI DISTRIBUTION LIMITED,"Grid Management, Maintenance, Energy Efficiency",Ahmedabad,MBA
Mineral Processing Engineer,KIOCL LIMITED,"Ore Processing, Environmental Compliance, Exploration, Surveying",Chennai,B.Sc
Product Manager,ADANI WILMAR LIMITED,"Supply Chain, Marketing, Distribution, Brand Management",Kolkata,B.Tech
Design Engineer,TATA POWER DELHI DISTRIBUTION LIMITED,"Transmission, Power Plant Operations, Thermal Power, Electrical Engineering",Jaipur,M.Sc
Cloud Architect,KARNAVATI AVIATION PRIVATE LIMITED,"SQL, Java, DevOps",Ahmedabad,BA
Treasury Analyst,ICICI PRUDENTIAL LIFE INSURANCE COMPANY LIMITED,"Investment Banking, Taxation, Accounting, Loan Processing",Delhi,Diploma
Risk Analyst,THE KARNATAKA BANK LIMITED,"Financial Analysis, Risk Management, Wealth Management, Financial Modeling",Mumbai,M.Sc
Site Engineer,GUJARAT ALKALIES AND CHEMICALS LIMITED,"Construction Management, Civil Engineering, Surveying",Lucknow,PhD
Construction Manager,AARTI INDUSTRIES LTD,"Safety Management, Estimation, Project Management, Civil Engineering",Ahmedabad,M.Sc
Structural Engineer,TRIDENT LIMITED,"Safety Management, Surveying, Quality Control, Estimation",Lucknow,Diploma
Electronics Engineer,HP INDIA SALES PRIVATE LIMITED,"Manufacturing, Embedded Systems, R&D",Hyderabad,PhD
DevOps Engineer,STANDARD CHARTERED GLOBAL BUSINESS SERVICES PRIVATE LIMITED,"Java, React, Machine Learning, Cloud Computing",Lucknow,BA
Transportation Specialist,ADANI HARBOUR SERVICES LIMITED,"Supply Chain Management, Warehouse Operations, Transportation",Mumbai,M.Sc
Loan Officer,IDFC FIRST BANK LIMITED,"Taxation, Wealth Management",Hyderabad,B.Tech
Supply Chain Analyst,RELIANCE RETAIL VENTURES LIMITED,"Supply Chain, Consumer Insights, Sales, Retail Management",Jaipur,M.Sc
Product Manager,RSPL LIMITED,"Sales, Consumer Insights, Marketing",Pune,BA
DevOps Engineer,BARCLAYS GLOBAL SERVICE CENTRE PRIVATE LIMITED,"Machine Learning, JavaScript, Cloud Computing, Python",Lucknow,Diploma
Structural Engineer,TRIDENT LIMITED,"Safety Management, Surveying, Quality Control, Estimation",Lucknow,Diploma
Marketing Executive,PROCTER & GAMBLE HOME PRODUCTS PRIVATE LIMITED,"Marketing, Brand Management, Retail Management, Supply Chain",Lucknow,PhD
Mining Engineer,ARCELORMITTAL NIPPON STEEL INDIA LIMITED,"Exploration, Mineral Processing",Jaipur,BCA
Project Engineer,3M INDIA LIMITED,"Construction Management, Structural Design",Chennai,B.Sc
Safety Officer,FINOLEX INDUSTRIES LIMITED,"Civil Engineering, Safety Management, Estimation, Construction Management",Delhi,M.Sc
Web Developer,FIDELITY BUSINESS SERVICES INDIA PRIVATE LIMITED,"JavaScript, Python, SQL",Mumbai,PhD
Marketing Executive,PI INDUSTRIES LIMITED,"Consumer Insights, Marketing",Jaipur,M.Sc
Civil Engineer,HEIDELBERGCEMENT INDIA LIMITED.,"Estimation, Project Management, Quality Control, Safety Management",Ahmedabad,B.Tech
Structural Engineer,KNR CONSTRUCTIONS LIMITED,"Safety Management, Surveying, Civil Engineering, Project Management",Remote,MBA
IT Support,MPHASIS LIMITED,"DevOps, Python, SQL",Hyderabad,M.Sc
QA Engineer,BAJAJ HOUSING FINANCE LIMITED,"Java, SQL, Python, Machine Learning",Mumbai,M.Sc
Web Developer,EDELWEISS ASSET RECONSTRUCTION COMPANY LIMITED,"SQL, DevOps, Java",Delhi,PhD
Web Developer,SIEMENS LIMITED,"React, SQL",Kolkata,BCA
Civil Engineer,PKC INFRATECH LIMITED,"Estimation, Structural Design, Surveying, Quality Control",Hyderabad,B.Com
Product Manager,IPCA LABORATORIES LIMITED,"Sales, Supply Chain, Retail Management, Brand Management",Ahmedabad,B.Com
Supply Chain Analyst,PARLE BISCUITS PRIVATE LIMITED,"Supply Chain, Marketing, Distribution, Brand Management",Pune,B.Tech
Web Developer,TOYOTA KIRLOSKAR MOTOR PRIVATE LIMITED,"Data Analysis, DevOps",Kolkata,B.Sc
Software Developer,INFOSYS LIMITED,"Python, Data Analysis, JavaScript, Cybersecurity",Delhi,Diploma
