internship_title,internship_company,required_skills,internship_location,required_education
Treasury Analyst,INDUSIND BANK LTD.,"Investment Banking, Accounting, Risk Management, Taxation",Kolkata,BCA
Loan Officer,KOTAK MAHINDRA LIFE INSURANCE COMPANY LIMITED,"Accounting, Investment Banking",Bangalore,BBA
Ore Processing Technician,INDIAN METALS AND FERRO ALLOYS LTD.,"Safety Management, Mineral Processing, Exploration, Environmental Compliance",Hyderabad,BBA
Marketing Executive,RELIANCE RETAIL LIMITED,"Consumer Insights, Retail Management, Sales, Brand Management",Remote,M.Sc
Exploration Geologist,HINDALCO INDUSTRIES LIMITED,"Safety Management, Exploration, Environmental Compliance, Surveying",Hyderabad,MBA
Mining Engineer,TUBE INVESTMENTS OF INDIA LIMITED,"Mineral Processing, Geology, Surveying",Jaipur,B.Sc
Web Developer,BAJAJ FINANCE LIMITED,"DevOps, Machine Learning",Remote,M.Sc
Site Engineer,NHDC LIMITED,"Quality Control, Estimation, Structural Design",Kolkata,MBA
Freight Coordinator,ADANI HAZIRA PORT LIMITED,"Warehouse Operations, Supply Chain Management",Jaipur,B.Sc
Quality Inspector,COLOURTEX INDUSTRIES PRIVATE LIMITED,"Structural Design, Quality Control, Surveying, Project Management",Hyderabad,PhD
Project Engineer,SHREE RAMKRISHNA EXPORTS PRIVATE LIMITED,"Construction Management, Quality Control, Surveying, Safety Management",Kolkata,Diploma
DevOps Engineer,STANDARD CHARTERED GLOBAL BUSINESS SERVICES PRIVATE LIMITED,"Java, React, Machine Learning, Cloud Computing",Lucknow,BA
QA Engineer,MAHINDRA AND MAHINDRA FINANCIAL SERVICES LIMITED,"DevOps, Machine Learning",Hyderabad,M.Sc
Retail Manager,LAURUS LABS LIMITED,"Product Development, Retail Management",Kolkata,MBA
Sales Executive,PERNOD RICARD INDIA PRIVATE LIMITED,"Consumer Insights, Marketing",Kolkata,B.Com
Supply Chain Analyst,PI INDUSTRIES LIMITED,"Supply Chain, Retail Management, Marketing, Distribution",Lucknow,BA
Petroleum Engineer,ADANI TOTAL GAS LIMITED,"Geology, Field Operations, Pipeline Maintenance",Lucknow,MBA
Web Developer,SAMMAAN CAPITAL LIMITED,"Java, DevOps",Jaipur,BA
Supply Chain Analyst,RELIANCE RETAIL VENTURES LIMITED,"Supply Chain, Consumer Insights, Sales, Retail Management",Jaipur,M.Sc
Credit Analyst,CITY UNION BANK LIMITED,"Financial Modeling, Accounting, Taxation, Financial Analysis",Ahmedabad,BA
QA Engineer,PRESTIGE ESTATES PROJECTS LIMITED,"Java, Python, React, JavaScript",Kolkata,BBA
Machine Learning Engineer,CROMPTON GREAVES CONSUMER ELECTRICALS LIMITED,"React, SQL, Cloud Computing, Python",Remote,B.Sc
Process Engineer,OIL AND NATURAL GAS CORPORATION LIMITED,"Field Operations, Safety Compliance, Reservoir Engineering, Petroleum Engineering",Jaipur,PhD
Distribution Executive,UPL LIMITED,"Brand Management, Consumer Insights, Distribution, Marketing",Bangalore,B.Tech
Drilling Engineer,MANGALORE REFINERY AND PETROCHEMICALS LIMITED,"Safety Compliance, Petroleum Engineering, Drilling Operations, Geology",Jaipur,BCA
Ore Processing Technician,NMDC LIMITED,"Safety Management, Mineral Processing",Kolkata,Diploma
Consumer Insights Analyst,NIRMA LIMITED,"Brand Management, Product Development, Marketing",Hyderabad,BBA
Marketing Executive,PI INDUSTRIES LIMITED,"Consumer Insights, Marketing",Jaipur,M.Sc
DevOps Engineer,LIC HOUSING FINANCE LTD,"Cybersecurity, React, Cloud Computing",Jaipur,M.Sc
Brand Manager,GILLETTE INDIA LIMITED,"Distribution, Product Development, Supply Chain",Remote,PhD
QA Engineer,KOTAK SECURITIES LIMITED,"Java, SQL, Cybersecurity, Python",Mumbai,B.Tech
Supply Chain Analyst,RITES LIMITED,"Inventory Management, Logistics Planning, Distribution",Pune,BCA
Geologist,BIOP STEELS & POWER PRIVATE LIMITED,"Surveying, Ore Processing, Environmental Compliance",Remote,M.Sc
Web Developer,LTIMINDTREE LIMITED,"JavaScript, SQL, Cloud Computing, Java",Chennai,BA
Freight Coordinator,ADANI HAZIRA PORT LIMITED,"Warehouse Operations, Supply Chain Management",Jaipur,B.Sc
IT Support,TATA CAPITAL HOUSING FINANCE LIMITED,"Cloud Computing, JavaScript",Hyderabad,BA
Consumer Insights Analyst,IPCA LABORATORIES LIMITED,"Distribution, Supply Chain, Brand Management",Mumbai,MBA
Quality Inspector,TAMILNADU POWER FINANCE AND INFRASTRUCTURE DEVELOPMENT CORPORATION LIMITED,"Safety Management, Civil Engineering",Mumbai,BBA
Environmental Officer,INDIAN METALS AND FERRO ALLOYS LTD.,"Geology, Safety Management",Kolkata,MBA
Supply Chain Analyst,HINDUSTAN COCA-COLA BEVERAGES PRIVATE LIMITED,"Sales, Brand Management, Distribution, Product Development",Bangalore,B.Sc
Quality Inspector,AARTI INDUSTRIES LTD,"Structural Design, Project Management, Estimation",Mumbai,BCA
Thermal Engineer,KARNATAKA POWER TRANSMISSION CORPORATION LIMITED,"Energy Efficiency, Transmission, Thermal Power, Grid Management",Bangalore,MBA
Risk Analyst,THE NEW INDIA ASSURANCE COMPANY LIMITED,"Investment Banking, Loan Processing",Pune,BCA
Supply Chain Analyst,RSPL LIMITED,"Supply Chain, Consumer Insights",Kolkata,B.Tech
Electronics Engineer,HP INDIA SALES PRIVATE LIMITED,"Electronics Design, Testing",Delhi,PhD
Retail Manager,GODREJ CONSUMER PRODUCTS LIMITED,"Supply Chain, Marketing, Product Development, Consumer Insights",Jaipur,Diploma
Cloud Architect,INFOSYS BPM LIMITED,"Data Analysis, DevOps",Jaipur,B.Sc
Surveyor,GUJARAT NARMADA VALLEY FERTILIZERS & CHEMICALS LIMITED,"Safety Management, Surveying, Construction Management",Pune,BA
Cloud Architect,CAPGEMINI TECHNOLOGY SERVICES INDIA LIMITED,"React, Java, Python, Cloud Computing",Mumbai,B.Com
Product Manager,ADANI WILMAR LIMITED,"Supply Chain, Marketing, Distribution, Brand Management",Kolkata,B.Tech
Construction Manager,DEEPAK NITRITE LIMITED,"Construction Management, Estimation",Mumbai,Diploma
IT Support,CROMPTON GREAVES CONSUMER ELECTRICALS LIMITED,"Machine Learning, Python, Cloud Computing",Lucknow,BBA
DevOps Engineer,RELIANCE INDUSTRIES LIMITED,"Cloud Computing, Python, React, Machine Learning",Jaipur,B.Com
Web Developer,ICICI SECURITIES PRIMARY DEALERSHIP LIMITED,"React, Python, Data Analysis",Chennai,Diploma
Machine Learning Engineer,WNS GLOBAL SERVICES PRIVATE LIMITED,"DevOps, Cloud Computing",Chennai,BA
IT Support,SKF INDIA LIMITED,"JavaScript, DevOps",Jaipur,BBA
Design Engineer,THDC INDIA LIMITED,"Maintenance, Thermal Power, Power Plant Operations",Pune,BBA
Product Manager,ZYDUS LIFESCIENCES LIMITED,"Sales, Marketing",Pune,B.Sc
Site Engineer,DALMIA CEMENT (BHARAT) LIMITED,"Surveying, Construction Management, Estimation",Jaipur,Diploma
Civil Engineer,AARTI INDUSTRIES LTD,"Civil Engineering, Surveying, Project Management, Construction Management",Delhi,BCA
Software Developer,APARNA INFRAHOUSING PRIVATE LIMITED (PART IX),"Cloud Computing, Machine Learning, Cybersecurity, Java",Jaipur,M.Sc
Software Developer,FIDELITY BUSINESS SERVICES INDIA PRIVATE LIMITED,"Cybersecurity, Machine Learning, Cloud Computing",Mumbai,BA
Distribution Executive,MONDELEZ INDIA FOODS PRIVATE LIMITED,"Consumer Insights, Sales, Marketing, Distribution",Delhi,M.Sc
Consumer Insights Analyst,YASHODA HEALTHCARE SERVICES PRIVATE LIMITED,"Consumer Insights, Product Development, Supply Chain, Distribution",Bangalore,MBA
Risk Analyst,AXIS BANK LIMITED,"Financial Analysis, Investment Banking, Taxation",Delhi,B.Com
Safety Officer,BRAHMAPUTRA CRACKER AND POLYMER LIMITED,"Structural Design, Surveying",Lucknow,PhD
Web Developer,REC LIMITED,"Data Analysis, DevOps, Java",Mumbai,BCA
Product Manager,IPCA LABORATORIES LIMITED,"Sales, Supply Chain, Retail Management, Brand Management",Ahmedabad,B.Com
Retail Manager,PIRAMAL PHARMA LIMITED,"Product Development, Supply Chain, Retail Management",Delhi,B.Sc
Electrical Engineer,JSW ENERGY LIMITED,"Transmission, Energy Efficiency, Maintenance, Power Plant Operations",Delhi,MBA
DevOps Engineer,SKODA AUTO VOLKSWAGEN INDIA PRIVATE LIMITED,"DevOps, Java",Remote,B.Tech
Software Developer,WELLS FARGO INTERNATIONAL SOLUTIONS PRIVATE LIMITED,"Data Analysis, React",Delhi,B.Com
Data Analyst,FINOLEX CABLES LIMITED,"Python, Cloud Computing",Bangalore,B.Sc
IT Support,CROMPTON GREAVES CONSUMER ELECTRICALS LIMITED,"Machine Learning, Python, Cloud Computing",Lucknow,BBA
Cloud Architect,KAJARIA CERAMICS LIMITED,"React, Java, JavaScript, DevOps",Ahmedabad,BBA
IT Support,ECGC LIMITED,"Cloud Computing, Java, JavaScript",Pune,BCA
Cloud Architect,COGNIZANT TECHNOLOGY SOLUTIONS INDIA PRIVATE LIMITED,"Data Analysis, DevOps, Machine Learning",Jaipur,BBA
Financial Analyst,MAX LIFE INSURANCE COMPANY LIMITED,"Financial Modeling, Risk Management, Investment Banking, Taxation",Hyderabad,MBA
Distribution Executive,DABUR INDIA LIMITED,"Retail Management, Product Development, Sales",Mumbai,B.Sc
Data Analyst,CGI INFORMATION SYSTEMS AND MANAGEMENT CONSULTANTS PRIVATE LIMITED,"Java, React",Jaipur,BA
Sales Executive,MANKIND PHARMA LIMITED,"Retail Management, Brand Management, Product Development",Pune,B.Com
Distribution Executive,PI INDUSTRIES LIMITED,"Marketing, Brand Management, Sales",Jaipur,MBA
Software Developer,BA CONTINUUM INDIA PRIVATE LIMITED,"Cybersecurity, SQL",Jaipur,BA
QA Engineer,VOLTAS LIMITED,"SQL, Machine Learning",Mumbai,MBA
Web Developer,INTERNATIONAL TRACTORS LIMITED,"DevOps, React, SQL, Data Analysis",Chennai,BA
Safety Officer,HINDALCO INDUSTRIES LIMITED,"Environmental Compliance, Ore Processing, Safety Management",Delhi,BA
IT Support,J. P. MORGAN SERVICES INDIA PRIVATE LIMITED,"Cloud Computing, Data Analysis",Pune,B.Com
Brand Manager,MAHASHIAN DI HATTI PRIVATE LIMITED,"Marketing, Product Development",Kolkata,PhD
Data Analyst,ACCENTURE SOLUTIONS PRIVATE LIMITED,"Cloud Computing, React",Ahmedabad,M.Sc
Machine Learning Engineer,CORTEVA AGRISCIENCE SEEDS PRIVATE LIMITED,"Java, Cloud Computing, Machine Learning, DevOps",Ahmedabad,PhD
Cloud Architect,SBI CARDS AND PAYMENT SERVICES LIMITED,"JavaScript, Java",Mumbai,M.Sc
Project Engineer,DEEPAK NITRITE LIMITED,"Estimation, Civil Engineering, Structural Design",Remote,B.Tech
Marketing Executive,EVEREST FOOD PRODUCTS PRIVATE LIMITED,"Consumer Insights, Brand Management, Product Development, Sales",Hyderabad,BBA
Marketing Executive,PROCTER & GAMBLE HOME PRODUCTS PRIVATE LIMITED,"Marketing, Brand Management, Retail Management, Supply Chain",Lucknow,PhD
Credit Analyst,SHRIRAM GENERAL INSURANCE COMPANY LIMITED,"Wealth Management, Financial Modeling, Investment Banking",Jaipur,M.Sc
Mineral Processing Engineer,MAITHAN ALLOYS LTD.,"Exploration, Mineral Processing",Bangalore,B.Tech
DevOps Engineer,SKF INDIA LIMITED,"DevOps, SQL",Lucknow,B.Com
Data Analyst,ZEROIDA BROKING LIMITED,"React, Machine Learning, DevOps",Mumbai,BBA
Thermal Engineer,NUCLEAR POWER CORPORATION OF INDIA LIMITED,"Transmission, Grid Management, Renewable Energy, Electrical Engineering",Pune,Diploma
Process Engineer,OIL AND NATURAL GAS CORPORATION LIMITED,"Field Operations, Safety Compliance, Reservoir Engineering, Petroleum Engineering",Jaipur,PhD
Distribution Manager,CONTAINER CORPORATION OF INDIA LIMITED,"Logistics Planning, Inventory Management, Supply Chain Management",Bangalore,B.Com
Safety Officer,WELSPUN LIVING LIMITED,"Construction Management, Quality Control, Civil Engineering",Mumbai,M.Sc
Construction Manager,AARTI INDUSTRIES LTD,"Safety Management, Estimation, Project Management, Civil Engineering",Ahmedabad,M.Sc
Cloud Architect,CAPGEMINI TECHNOLOGY SERVICES INDIA LIMITED,"React, Java, Python, Cloud Computing",Mumbai,B.Com
Field Engineer,NUMALIGARH REFINERY LTD,"Reservoir Engineering, Field Operations",Ahmedabad,PhD
Machine Learning Engineer,VOLTAS LIMITED,"Cybersecurity, React",Jaipur,PhD
Safety Officer,BRAHMAPUTRA CRACKER AND POLYMER LIMITED,"Structural Design, Surveying",Lucknow,PhD
Structural Engineer,WONDER CEMENT LIMITED,"Quality Control, Civil Engineering, Surveying",Chennai,BCA
IT Support,HONEYWELL TECHNOLOGY SOLUTIONS LAB PRIVATE LIMITED,"Java, Cloud Computing, Python",Delhi,B.Tech
Treasury Analyst,TAMILNAD MERCANTILE BANK LIMITED,"Financial Modeling, Financial Analysis, Risk Management, Investment Banking",Remote,MBA
Design Engineer,INDIAN ENERGY EXCHANGE LIMITED,"Thermal Power, Transmission, Electrical Engineering, Renewable Energy",Kolkata,M.Sc
Data Analyst,BALRAMPUR CHINI MILLS LTD,"SQL, Cloud Computing",Remote,BBA
Site Engineer,HEIDELBERGCEMENT INDIA LIMITED.,"Quality Control, Safety Management, Structural Design, Project Management",Hyderabad,PhD
QA Engineer,CAPGEMINI TECHNOLOGY SERVICES INDIA LIMITED,"DevOps, Cloud Computing, Machine Learning, SQL",Jaipur,PhD
Ore Processing Technician,MAHANADI COALFIELDS LIMITED,"Exploration, Mineral Processing, Geology",Chennai,Diploma
Supply Chain Analyst,UNITED SPIRITS LIMITED,"Consumer Insights, Brand Management",Jaipur,B.Tech
Machine Learning Engineer,FINOLEX CABLES LIMITED,"SQL, DevOps",Mumbai,B.Com
Product Manager,RSPL LIMITED,"Sales, Consumer Insights, Marketing",Pune,BA
IT Support,INFOSYS BPM LIMITED,"Python, Machine Learning, React",Remote,MBA
Surveyor,DECCAN FINE CHEMICALS (INDIA) PRIVATE LIMITED,"Safety Management, Surveying, Project Management, Construction Management",Bangalore,BCA
Grid Engineer,POWER GRID CORPORATION OF INDIA LIMITED,"Thermal Power, Renewable Energy, Electrical Engineering",Delhi,B.Tech
Web Developer,DXC TECHNOLOGY INDIA PRIVATE LIMITED,"Python, Cybersecurity, Java, DevOps",Jaipur,Diploma
Software Developer,SMFG INDIA CREDIT COMPANY LIMITED,"Cybersecurity, React, SQL, Data Analysis",Bangalore,MBA
Geologist,GUJARAT STATE PETRONET LIMITED,"Reservoir Engineering, Pipeline Maintenance, Petroleum Engineering",Remote,B.Com
Software Developer,HONDA MOTORCYCLE AND SCOOTER INDIA PVT LTD,"React, SQL, Cybersecurity, Data Analysis",Chennai,B.Sc
Software Developer,APARNA INFRAHOUSING PRIVATE LIMITED (PART IX),"Cloud Computing, Machine Learning, Cybersecurity, Java",Jaipur,M.Sc
Site Engineer,BHILOSA INDUSTRIES PRIVATE LIMITED,"Project Management, Quality Control, Civil Engineering, Safety Management",Chennai,B.Sc
Consumer Insights Analyst,ALKEM LABORATORIES LIMITED,"Consumer Insights, Distribution, Brand Management, Retail Management",Pune,Diploma
IT Support,CHOLAMANDALAM INVESTMENT AND FINANCE COMPANY LIMITED,"Machine Learning, Cybersecurity, Cloud Computing, JavaScript",Hyderabad,MBA
Ore Processing Technician,VEDANTA LIMITED,"Exploration, Environmental Compliance, Mining Engineering",Delhi,PhD
Site Engineer,SAINT-GOBAIN INDIA PRIVATE LIMITED,"Project Management, Estimation, Surveying",Mumbai,B.Tech
Supply Chain Analyst,INTAS PHARMACEUTICALS LIMITED,"Product Development, Consumer Insights, Supply Chain",Lucknow,BBA
Credit Analyst,SHRIRAM GENERAL INSURANCE COMPANY LIMITED,"Wealth Management, Financial Modeling, Investment Banking",Jaipur,M.Sc
Software Developer,ATRIA CONVERGENCE TECHNOLOGIES LIMITED,"Python, Cloud Computing",Chennai,B.Sc
Project Engineer,IL&FS TAMIL NADU POWER COMPANY LIMITED,"Power Plant Operations, Energy Efficiency, Grid Management, Renewable Energy",Jaipur,B.Tech
Credit Analyst,CITY UNION BANK LIMITED,"Financial Analysis, Financial Modeling, Investment Banking, Wealth Management",Jaipur,M.Sc
Machine Learning Engineer,CUMMINS INDIA LIMITED,"Java, DevOps",Pune,BCA
DevOps Engineer,DLF LIMITED,"Python, SQL, Cybersecurity",Kolkata,BA
Cloud Architect,MANAPPURAM FINANCE LIMITED,"React, Machine Learning, Java, SQL",Pune,PhD
Financial Analyst,BAJAJ ALLIANZ GENERAL INSURANCE COMPANY LIMITED,"Financial Modeling, Wealth Management, Investment Banking",Pune,BBA
Distribution Executive,MONDELEZ INDIA FOODS PRIVATE LIMITED,"Consumer Insights, Sales, Marketing, Distribution",Delhi,M.Sc
Data Analyst,SUNDARAM FINANCE LIMITED,"Python, DevOps, Machine Learning, JavaScript",Delhi,PhD
Web Developer,DELL INTERNATIONAL SERVICES INDIA PRIVATE LIMITED,"Machine Learning, JavaScript, SQL",Pune,BBA
Consumer Insights Analyst,PROCTER & GAMBLE HYGIENE AND HEALTH CARE LIMITED,"Marketing, Consumer Insights, Supply Chain",Pune,Diploma
Software Developer,ADITYA BIRLA SUN LIFE AMC LIMITED,"Data Analysis, Java, Cloud Computing",Kolkata,B.Com
Distribution Executive,ALKEM LABORATORIES LIMITED,"Brand Management, Retail Management",Chennai,BA
Software Developer,APARNA INFRAHOUSING PRIVATE LIMITED (PART IX),"Cloud Computing, Machine Learning, Cybersecurity, Java",Jaipur,M.Sc
Cloud Architect,TATA CAPITAL FINANCIAL SERVICES LIMITED,"DevOps, Cloud Computing",Delhi,BCA
QA Engineer,HDB FINANCIAL SERVICES LIMITED,"Java, Python, Machine Learning, Cybersecurity",Kolkata,B.Sc
Supply Chain Analyst,TORRENT PHARMACEUTICALS LTD,"Marketing, Product Development, Distribution, Supply Chain",Delhi,BCA
System Integrator,STERLITE TECHNOLOGIES LIMITED,"5G Technology, Optical Fiber",Remote,Diploma
Mining Engineer,HINDALCO INDUSTRIES LIMITED,"Exploration, Surveying",Chennai,B.Tech
QA Engineer,VIACOM 18 MEDIA PRIVATE LIMITED,"Java, Cybersecurity",Ahmedabad,BA
Distribution Executive,MONDELEZ INDIA FOODS PRIVATE LIMITED,"Brand Management, Consumer Insights, Supply Chain, Product Development",Ahmedabad,Diploma
Machine Learning Engineer,HDFC ASSET MANAGEMENT COMPANY LIMITED,"Python, React",Jaipur,B.Sc
DevOps Engineer,LTIMINDTREE LIMITED,"React, Java",Remote,Diploma
Distribution Executive,DHARAMPAL SATYAPAL LIMITED,"Product Development, Sales, Marketing, Retail Management",Delhi,B.Sc
Brand Manager,GLENMARK PHARMACEUTICALS LIMITED,"Brand Management, Marketing, Product Development, Distribution",Kolkata,BA
Power Plant Operator,TANJORE POWER LIMITED,"Energy Efficiency, Thermal Power",Chennai,MBA
Surveyor,D P F TEXTILES PRIVATE LIMITED,"Structural Design, Project Management, Safety Management",Bangalore,B.Sc
Sales Executive,RECKITT BENCKISER (INDIA) PRIVATE LIMITED,"Consumer Insights, Retail Management",Hyderabad,M.Sc
Sales Executive,TATA CONSUMER PRODUCTS LIMITED,"Brand Management, Marketing, Retail Management, Supply Chain",Hyderabad,PhD
Construction Manager,GHARDA CHEMICALS LIMITED,"Safety Management, Quality Control",Jaipur,BA
DevOps Engineer,AMARA RAJA ENERGY & MOBILITY LIMITED,"React, Python, Cybersecurity, Java",Ahmedabad,PhD
Marketing Executive,GLENMARK PHARMACEUTICALS LIMITED,"Product Development, Distribution, Marketing, Retail Management",Delhi,B.Tech
Construction Manager,MSPL LIMITED,"Construction Management, Project Management, Safety Management, Civil Engineering",Pune,Diploma
Data Analyst,NOKIA SOLUTIONS AND NETWORKS INDIA PRIVATE LIMITED,"RF Engineering, Optical Fiber",Hyderabad,MBA
Cloud Architect,ADOBE SYSTEMS INDIA PRIVATE LIMITED,"Python, React, SQL, Machine Learning",Chennai,BCA
IT Support,ECGC LIMITED,"Cloud Computing, Java, JavaScript",Pune,BCA
Grid Engineer,POWER GRID CORPORATION OF INDIA LIMITED,"Thermal Power, Renewable Energy, Electrical Engineering",Delhi,B.Tech
Data Analyst,SUNDARAM FINANCE LIMITED,"Python, DevOps, Machine Learning, JavaScript",Delhi,PhD
Project Engineer,THE ASSOCIATED BUILDING COMPANY LIMITED,"Project Management, Structural Design, Civil Engineering",Remote,Diploma
Web Developer,INFOSYS LIMITED,"Java, Data Analysis, React",Delhi,BCA
IT Support,INDIAN RAILWAY FINANCE CORPORATION LIMITED,"Python, Java, React, Cloud Computing",Jaipur,BA
Accountant,INDUSIND BANK LTD.,"Taxation, Financial Analysis, Accounting, Financial Modeling",Hyderabad,B.Sc
Geologist,INOX AIR PRODUCTS PRIVATE LIMITED,"Refining, Reservoir Engineering",Ahmedabad,M.Sc
Cloud Architect,EDGEVERVE SYSTEMS LIMITED,"Cloud Computing, DevOps, Java",Jaipur,Diploma
Hardware Engineer,BHARAT ELECTRONICS LIMITED,"Electronics Design, R&D, Circuit Design, Quality Control",Chennai,Diploma
DevOps Engineer,TAFE MOTORS AND TRACTORS LIMITED,"Python, JavaScript, Java, Cybersecurity",Pune,B.Sc
Environmental Officer,PRAKASH INDUSTRIES LIMITED,"Ore Processing, Safety Management",Bangalore,MBA
Maintenance Engineer,TORRENT POWER LIMITED,"Electrical Engineering, Grid Management",Lucknow,B.Sc
Procurement Executive,ADANI HARBOUR SERVICES LIMITED,"Warehouse Operations, Distribution",Hyderabad,M.Sc
DevOps Engineer,AMARA RAJA ENERGY & MOBILITY LIMITED,"React, Python, Cybersecurity, Java",Ahmedabad,PhD
Safety Officer,BHUSHAN POWER & STEEL LIMITED,"Ore Processing, Exploration, Surveying, Environmental Compliance",Remote,B.Com
Ore Processing Technician,INDIAN METALS AND FERRO ALLOYS LTD.,"Safety Management, Mineral Processing, Exploration, Environmental Compliance",Hyderabad,BBA
Site Engineer,DEEPAK NITRITE LIMITED,"Project Management, Civil Engineering, Safety Management",Lucknow,Diploma
Product Manager,PIRAMAL PHARMA LIMITED,"Sales, Retail Management, Distribution, Product Development",Pune,B.Sc
Power Plant Operator,POWER GRID CORPORATION OF INDIA LIMITED,"Grid Management, Maintenance",Kolkata,B.Com
Product Manager,GODREJ CONSUMER PRODUCTS LIMITED,"Consumer Insights, Marketing",Kolkata,M.Sc
Sales Executive,DHARAMPAL SATYAPAL LIMITED,"Sales, Brand Management, Marketing",Lucknow,B.Com
Civil Engineer,CHAMBAL FERTILISERS AND CHEMICALS LIMITED,"Structural Design, Estimation, Surveying, Civil Engineering",Lucknow,B.Tech
Supply Chain Analyst,IPCA LABORATORIES LIMITED,"Distribution, Brand Management, Product Development",Hyderabad,BBA
Mineral Processing Engineer,NATIONAL ALUMINIUM CO LTD,"Mineral Processing, Geology, Environmental Compliance, Surveying",Chennai,MBA
Renewable Energy Specialist,ADANI TRANSMISSION (INDIA) LIMITED,"Grid Management, Maintenance, Electrical Engineering, Power Plant Operations",Jaipur,BBA
Safety Officer,INDIAN METALS AND FERRO ALLOYS LTD.,"Surveying, Mining Engineering",Remote,BA
Web Developer,FIDELITY BUSINESS SERVICES INDIA PRIVATE LIMITED,"JavaScript, Python, SQL",Mumbai,PhD
Sales Executive,DR.REDDY S LABORATORIES LTD,"Product Development, Consumer Insights, Distribution, Supply Chain",Lucknow,B.Sc
Cloud Architect,SBI CARDS AND PAYMENT SERVICES LIMITED,"JavaScript, Java",Mumbai,M.Sc
Data Analyst,CGI INFORMATION SYSTEMS AND MANAGEMENT CONSULTANTS PRIVATE LIMITED,"Java, React",Jaipur,BA
IT Support,VMWARE SOFTWARE INDIA PRIVATE LIMITED,"React, Cybersecurity, Cloud Computing, DevOps",Kolkata,BA
Software Developer,FRANKLIN TEMPLETON ASSET MANAGEMENT (INDIA) PRIVATE LIMITED,"React, Java, Machine Learning, Data Analysis",Ahmedabad,M.Sc
IT Support,BA CONTINUUM INDIA PRIVATE LIMITED,"SQL, React, Machine Learning, JavaScript",Bangalore,B.Sc
Design Engineer,TRANSMISSION CORPORATION OF TELANGANA LIMITED,"Renewable Energy, Grid Management",Hyderabad,Diploma
Cloud Architect,NATIONAL PAYMENTS CORPORATION OF INDIA,"Python, DevOps, Data Analysis",Remote,PhD
DevOps Engineer,LIC HOUSING FINANCE LTD,"Cybersecurity, React, Cloud Computing",Jaipur,M.Sc
Drilling Engineer,MAHANAGAR GAS LIMITED,"Petroleum Engineering, Pipeline Maintenance, Safety Compliance",Kolkata,BCA
DevOps Engineer,JOHN DEERE INDIA PRIVATE LIMITED,"JavaScript, SQL, React, Cloud Computing",Bangalore,B.Com
Ore Processing Technician,VEDANTA LIMITED,"Exploration, Environmental Compliance, Mining Engineering",Delhi,PhD
Financial Analyst,KOTAK MAHINDRA BANK LIMITED,"Investment Banking, Financial Modeling, Accounting, Auditing",Delhi,Diploma
Data Analyst,WIPRO LIMITED,"Python, Machine Learning, JavaScript, DevOps",Hyderabad,Diploma
Mineral Processing Engineer,PRAKASH INDUSTRIES LIMITED,"Surveying, Safety Management",Chennai,BBA
DevOps Engineer,NIPPON LIFE INDIA ASSET MANAGEMENT LIMITED,"SQL, Machine Learning, DevOps, JavaScript",Remote,B.Com
Web Developer,DELL INTERNATIONAL SERVICES INDIA PRIVATE LIMITED,"Machine Learning, JavaScript, SQL",Pune,BBA
Risk Analyst,THE NEW INDIA ASSURANCE COMPANY LIMITED,"Investment Banking, Loan Processing",Pune,BCA
Construction Manager,GHARDA CHEMICALS LIMITED,"Safety Management, Quality Control",Jaipur,BA
Web Developer,ADOBE SYSTEMS INDIA PRIVATE LIMITED,"SQL, Java, Python, Cybersecurity",Hyderabad,Diploma
Marketing Executive,PROCTER & GAMBLE HYGIENE AND HEALTH CARE LIMITED,"Supply Chain, Marketing, Brand Management, Sales",Hyderabad,B.Sc
Brand Manager,SUN PHARMACEUTICAL INDUSTRIES LIMITED,"Brand Management, Consumer Insights, Product Development",Lucknow,M.Sc
Sales Executive,BHARAT BIOTECH INTERNATIONAL LIMITED,"Sales, Retail Management",Chennai,B.Sc
Data Analyst,FRANKLIN TEMPLETON ASSET MANAGEMENT (INDIA) PRIVATE LIMITED,"JavaScript, React",Hyderabad,BA
Credit Analyst,HDFC ERGO GENERAL INSURANCE COMPANY LIMITED,"Risk Management, Financial Analysis, Accounting, Investment Banking",Hyderabad,BBA
Sales Executive,SUN PHARMACEUTICAL INDUSTRIES LIMITED,"Consumer Insights, Brand Management, Sales",Jaipur,BA
Construction Manager,YARROW INFRASTRUCTURE PRIVATE LIMITED,"Structural Design, Civil Engineering",Remote,PhD
Retail Manager,PIRAMAL PHARMA LIMITED,"Product Development, Supply Chain, Retail Management",Delhi,B.Sc
Cloud Architect,ZEE ENTERTAINMENT ENTERPRISES LIMITED,"Java, DevOps, React, Data Analysis",Jaipur,B.Sc
Cloud Architect,ESCORTS KUBOTA LIMITED,"Data Analysis, Cybersecurity",Ahmedabad,Diploma
Data Analyst,SBI FUNDS MANAGEMENT LIMITED,"DevOps, Machine Learning",Bangalore,M.Sc
Surveyor,RAIL VIKAS NIGAM LIMITED,"Construction Management, Surveying, Safety Management, Quality Control",Ahmedabad,M.Sc
Brand Manager,AVENUE SUPERMARTS LIMITED,"Brand Management, Consumer Insights, Product Development, Marketing",Delhi,BA
Software Developer,BAJAJ HOLDINGS & INVESTMENT LIMITED.,"DevOps, Python, Data Analysis, Cloud Computing",Lucknow,Diploma
Grid Engineer,JSW ENERGY (BARMER) LIMITED,"Transmission, Thermal Power, Energy Efficiency",Chennai,BCA
DevOps Engineer,TATA SONS PRIVATE LIMITED,"Cloud Computing, Python, JavaScript",Hyderabad,M.Sc
Mineral Processing Engineer,GUJARAT MINERAL DEVELOPMENT CORPORATION LIMITED,"Surveying, Exploration, Environmental Compliance, Ore Processing",Ahmedabad,B.Com
Credit Analyst,CITY UNION BANK LIMITED,"Financial Analysis, Financial Modeling, Investment Banking, Wealth Management",Jaipur,M.Sc
DevOps Engineer,JAQUAR AND COMPANY PRIVATE LIMITED,"JavaScript, Cybersecurity",Pune,B.Sc
Thermal Engineer,NTPC LIMITED,"Renewable Energy, Power Plant Operations",Bangalore,B.Sc
Safety Officer,FINOLEX INDUSTRIES LIMITED,"Civil Engineering, Safety Management, Estimation, Construction Management",Delhi,M.Sc
Distribution Executive,FRIGORIFICO ALLANA PRIVATE LIMITED,"Marketing, Retail Management, Product Development, Sales",Kolkata,BBA
